inferencing_benchmark/tvm/resnet-50-p3-B1-cuda.json
{"i": [["[\"254e44c32ef688b0884d158c1b90abc6\", 1, 3, 230, 230, 64, 3, 7, 7, 1, 64, 1, 1, 1, 64, 1, 1, 1, 64, 1, 1, 1, 64, 112, 112]", "cuda -keys=cuda,gpu -max_num_threads=1024 -thread_warp_size=32", [-1, 16, 64, 49152, 2147483647, 1024, 8, 32], "", 0, []], [[], [["CI", 9], ["CI", 7], ["CI", 5], ["SP", 3, 0, 1, [1, 1, 1, 1], 1], ["SP", 3, 5, 64, [1, 4, 1, 16], 1], ["SP", 3, 10, 112, [1, 4, 1, 1], 1], ["SP", 3, 15, 112, [1, 28, 1, 1], 1], ["SP", 3, 20, 3, [1, 1], 1], ["SP", 3, 23, 7, [1, 7], 1], ["SP", 3, 26, 7, [7, 1], 1], ["RE", 3, [0, 5, 10, 15, 1, 6, 11, 16, 2, 7, 12, 17, 20, 23, 26, 21, 24, 27, 3, 8, 13, 18, 22, 25, 28, 4, 9, 14, 19]], ["FSP", 10, 0, 3, 3], ["FSP", 10, 4, 4, 3], ["FSP", 10, 8, 5, 3], ["FSP", 10, 12, 6, 3], ["RE", 10, [0, 4, 8, 12, 1, 5, 9, 13, 2, 6, 10, 14, 3, 7, 11, 15]], ["CA", 3, 10, 11], ["CHR", 2, "shared", [3]], ["CA", 3, 4, 14], ["CHR", 1, "shared", [4]], ["CA", 2, 5, 14], ["CI", 1], ["FU", 12, [0, 1, 2, 3]], ["AN", 12, 0, 5], ["FU", 12, [1, 2, 3, 4]], ["AN", 12, 1, 4], ["FU", 12, [2, 3, 4, 5]], ["AN", 12, 2, 6], ["FU", 4, [0, 1, 2, 3]], ["SP", 4, 0, 98, [1], 1], ["AN", 4, 1, 2], ["FFSP", 4, 0, [6, 5, 4, 3], 1, 1], ["AN", 4, 1, 6], ["FU", 2, [0, 1, 2, 3]], ["SP", 2, 0, 49, [1], 1], ["AN", 2, 1, 2], ["FFSP", 2, 0, [6, 5, 4, 3], 1, 1], ["AN", 2, 1, 6], ["PR", 5, 0, "auto_unroll_max_step$512"]]]], "r": [[6.03588e-05], 0, 1.88913, 1628016538], "v": "v0.6"}
{"i": [["[\"254e44c32ef688b0884d158c1b90abc6\", 1, 3, 230, 230, 64, 3, 7, 7, 1, 64, 1, 1, 1, 64, 1, 1, 1, 64, 1, 1, 1, 64, 112, 112]", "cuda -keys=cuda,gpu -max_num_threads=1024 -thread_warp_size=32", [-1, 16, 64, 49152, 2147483647, 1024, 8, 32], "", 0, []], [[], [["CI", 9], ["CI", 7], ["CI", 5], ["SP", 3, 0, 1, [1, 1, 1, 1], 1], ["SP", 3, 5, 64, [1, 2, 2, 2], 1], ["SP", 3, 10, 112, [1, 56, 1, 1], 1], ["SP", 3, 15, 112, [1, 8, 2, 1], 1], ["SP", 3, 20, 3, [1, 1], 1], ["SP", 3, 23, 7, [1, 1], 1], ["SP", 3, 26, 7, [1, 1], 1], ["RE", 3, [0, 5, 10, 15, 1, 6, 11, 16, 2, 7, 12, 17, 20, 23, 26, 21, 24, 27, 3, 8, 13, 18, 22, 25, 28, 4, 9, 14, 19]], ["FSP", 10, 0, 3, 3], ["FSP", 10, 4, 4, 3], ["FSP", 10, 8, 5, 3], ["FSP", 10, 12, 6, 3], ["RE", 10, [0, 4, 8, 12, 1, 5, 9, 13, 2, 6, 10, 14, 3, 7, 11, 15]], ["CA", 3, 10, 11], ["CHR", 2, "shared", [3]], ["CA", 3, 4, 14], ["CHR", 1, "shared", [4]], ["CA", 2, 5, 14], ["CI", 1], ["FU", 12, [0, 1, 2, 3]], ["AN", 12, 0, 5], ["FU", 12, [1, 2, 3, 4]], ["AN", 12, 1, 4], ["FU", 12, [2, 3, 4, 5]], ["AN", 12, 2, 6], ["FU", 4, [0, 1, 2, 3]], ["SP", 4, 0, 4, [1], 1], ["AN", 4, 1, 2], ["FFSP", 4, 0, [6, 5, 4, 3], 1, 1], ["AN", 4, 1, 6], ["FU", 2, [0, 1, 2, 3]], ["SP", 2, 0, 3, [3], 1], ["AN", 2, 1, 2], ["FFSP", 2, 0, [6, 5, 4, 3], 1, 1], ["AN", 2, 1, 6], ["PR", 5, 0, "auto_unroll_max_step$16"]]]], "r": [[0.000208143], 0, 1.77169, 1628016539], "v": "v0.6"}
{"i": [["[\"254e44c32ef688b0884d158c1b90abc6\", 1, 3, 230, 230, 64, 3, 7, 7, 1, 64, 1, 1, 1, 64, 1, 1, 1, 64, 1, 1, 1, 64, 112, 112]", "cuda -keys=cuda,gpu -max_num_threads=1024 -thread_warp_size=32", [-1, 16, 64, 49152, 2147483647, 1024, 8, 32], "", 0, []], [[], [["CI", 9], ["CI", 7], ["CI", 5], ["SP", 3, 0, 1, [1, 1, 1, 1], 1], ["SP", 3, 5, 64, [1, 16, 1, 2], 1], ["SP", 3, 10, 112, [1, 1, 4, 4], 1], ["SP", 3, 15, 112, [4, 7, 1, 4], 1], ["SP", 3, 20, 3, [1, 1], 1], ["SP", 3, 23, 7, [7, 1], 1], ["SP", 3, 26, 7, [1, 1], 1], ["RE", 3, [0, 5, 10, 15, 1, 6, 11, 16, 2, 7, 12, 17, 20, 23, 26, 21, 24, 27, 3, 8, 13, 18, 22, 25, 28, 4, 9, 14, 19]], ["FSP", 10, 0, 3, 3], ["FSP", 10, 4, 4, 3], ["FSP", 10, 8, 5, 3], ["FSP", 10, 12, 6, 3], ["RE", 10, [0, 4, 8, 12, 1, 5, 9, 13, 2, 6, 10, 14, 3, 7, 11, 15]], ["CA", 3, 10, 11], ["CHR", 2, "shared", [3]], ["CA", 3, 4, 14], ["CHR", 1, "shared", [4]], ["CA", 2, 5, 14], ["CI", 1], ["FU", 12, [0, 1, 2, 3]], ["AN", 12, 0, 5], ["FU", 12, [1, 2, 3, 4]], ["AN", 12, 1, 4], ["FU", 12, [2, 3, 4, 5]], ["AN", 12, 2, 6], ["FU", 4, [0, 1, 2, 3]], ["SP", 4, 0, 14, [1], 1], ["AN", 4, 1, 2], ["FFSP", 4, 0, [6, 5, 4, 3], 1, 1], ["AN", 4, 1, 6], ["FU", 2, [0, 1, 2, 3]], ["SP", 2, 0, 259, [1], 1], ["AN", 2, 1, 2], ["FFSP", 2, 0, [6, 5, 4, 3], 1, 1], ["AN", 2, 1, 6], ["PR", 5, 0, "auto_unroll_max_step$16"]]]], "r": [[0.00145037], 0, 2.49192, 1628016541], "v": "v0.6"}
{"i": [["[\"254e44c32ef688b0884d158c1b90abc6\", 1, 3, 230, 230, 64, 3, 7, 7, 1, 64, 1, 1, 1, 64, 1, 1, 1, 64, 1, 1, 1, 64, 112, 112]", "cuda -keys=cuda,gpu -max_num_threads=1024 -thread_warp_size=32", [-1, 16, 64, 49152, 2147483647, 1024, 8, 32], "", 0, []], [[], [["CI", 9], ["CI", 7], ["CI", 5], ["SP", 3, 0, 1, [1, 1, 1, 1], 1], ["SP", 3, 5, 64, [2, 2, 2, 2], 1], ["SP", 3, 10, 112, [1, 8, 1, 1], 1], ["SP", 3, 15, 112, [1, 4, 2, 7], 1], ["SP", 3, 20, 3, [1, 1], 1], ["SP", 3, 23, 7, [7, 1], 1], ["SP", 3, 26, 7, [1, 7], 1], ["RE", 3, [0, 5, 10, 15, 1, 6, 11, 16, 2, 7, 12, 17, 20, 23, 26, 21, 24, 27, 3, 8, 13, 18, 22, 25, 28, 4, 9, 14, 19]], ["FSP", 10, 0, 3, 3], ["FSP", 10, 4, 4, 3], ["FSP", 10, 8, 5, 3], ["FSP", 10, 12, 6, 3], ["RE", 10, [0, 4, 8, 12, 1, 5, 9, 13, 2, 6, 10, 14, 3, 7, 11, 15]], ["CA", 3, 10, 11], ["CHR", 2, "shared", [3]], ["CA", 3, 4, 14], ["CHR", 1, "shared", [4]], ["CA", 2, 5, 14], ["CI", 1], ["FU", 12, [0, 1, 2, 3]], ["AN", 12, 0, 5], ["FU", 12, [1, 2, 3, 4]], ["AN", 12, 1, 4], ["FU", 12, [2, 3, 4, 5]], ["AN", 12, 2, 6], ["FU", 4, [0, 1, 2, 3]], ["SP", 4, 0, 588, [1], 1], ["AN", 4, 1, 2], ["FFSP", 4, 0, [6, 5, 4, 3], 1, 1], ["AN", 4, 1, 6], ["FU", 2, [0, 1, 2, 3]], ["SP", 2, 0, 693, [1], 1], ["AN", 2, 1, 2], ["FFSP", 2, 0, [6, 5, 4, 3], 1, 1], ["AN", 2, 1, 6], ["PR", 5, 0, "auto_unroll_max_step$64"]]]], "r": [[6.85631e-05], 0, 2.18161, 1628016542], "v": "v0.6"}
{"i": [["[\"254e44c32ef688b0884d158c1b90abc6\", 1, 3, 230, 230, 64, 3, 7, 7, 1, 64, 1, 1, 1, 64, 1, 1, 1, 64, 1, 1, 1, 64, 112, 112]", "cuda -keys=cuda,gpu -max_num_threads=1024 -thread_warp_size=32", [-1, 16, 64, 49152, 2147483647, 1024, 8, 32], "", 0, []], [[], [["CI", 9], ["CI", 7], ["CI", 5], ["SP", 3, 0, 1, [1, 1, 1, 1], 1], ["SP", 3, 5, 64, [1, 1, 4, 2], 1], ["SP", 3, 10, 112, [2, 2, 4, 1], 1], ["SP", 3, 15, 112, [2, 4, 7, 1], 1], ["SP", 3, 20, 3, [1, 3], 1], ["SP", 3, 23, 7, [1, 1], 1], ["SP", 3, 26, 7, [1, 1], 1], ["RE", 3, [0, 5, 10, 15, 1, 6, 11, 16, 2, 7, 12, 17, 20, 23, 26, 21, 24, 27, 3, 8, 13, 18, 22, 25, 28, 4, 9, 14, 19]], ["FSP", 10, 0, 3, 3], ["FSP", 10, 4, 4, 3], ["FSP", 10, 8, 5, 3], ["FSP", 10, 12, 6, 3], ["RE", 10, [0, 4, 8, 12, 1, 5, 9, 13, 2, 6, 10, 14, 3, 7, 11, 15]], ["CA", 3, 10, 11], ["CHR", 2, "shared", [3]], ["CA", 3, 4, 14], ["CHR", 1, "shared", [4]], ["CA", 2, 5, 14], ["CI", 1], ["FU", 12, [0, 1, 2, 3]], ["AN", 12, 0, 5], ["FU", 12, [1, 2, 3, 4]], ["AN", 12, 1, 4], ["FU", 12, [2, 3, 4, 5]], ["AN", 12, 2, 6], ["FU", 4, [0, 1, 2, 3]], ["SP", 4, 0, 6, [1], 1], ["AN", 4, 1, 2], ["FFSP", 4, 0, [6, 5, 4, 3], 1, 1], ["AN", 4, 1, 6], ["FU", 2, [0, 1, 2, 3]], ["SP", 2, 0, 273, [1], 1], ["AN", 2, 1, 2], ["FFSP", 2, 0, [6, 5, 4, 3], 1, 1], ["AN", 2, 1, 6], ["PR", 5, 0, "auto_unroll_max_step$0"]]]], "r": [[0.0188625], 0, 1.92133, 1628016543], "v": "v0.6"}
{"i": [["[\"254e44c32ef688b0884d158c1b90abc6\", 1, 3, 230, 230, 64, 3, 7, 7, 1, 64, 1, 1, 1, 64, 1, 1, 1, 64, 1, 1, 1, 64, 112, 112]", "cuda -keys=cuda,gpu -max_num_threads=1024 -thread_warp_size=32", [-1, 16, 64, 49152, 2147483647, 1024, 8, 32], "", 0, []], [[], [["CI", 9], ["CI", 7], ["CI", 5], ["SP", 3, 0, 1, [1, 1, 1, 1], 1], ["SP", 3, 5, 64, [2, 4, 2, 2], 1], ["SP", 3, 10, 112, [1, 14, 1, 4], 1], ["SP", 3, 15, 112, [2, 1, 2, 1], 1], ["SP", 3, 20, 3, [3, 1], 1], ["SP", 3, 23, 7, [7, 1], 1], ["SP", 3, 26, 7, [1, 7], 1], ["RE", 3, [0, 5, 10, 15, 1, 6, 11, 16, 2, 7, 12, 17, 20, 23, 26, 21, 24, 27, 3, 8, 13, 18, 22, 25, 28, 4, 9, 14, 19]], ["FSP", 10, 0, 3, 3], ["FSP", 10, 4, 4, 3], ["FSP", 10, 8, 5, 3], ["FSP", 10, 12, 6, 3], ["RE", 10, [0, 4, 8, 12, 1, 5, 9, 13, 2, 6, 10, 14, 3, 7, 11, 15]], ["CA", 3, 10, 11], ["CHR", 2, "shared", [3]], ["CA", 3, 4, 14], ["CHR", 1, "shared", [4]], ["CA", 2, 5, 14], ["CI", 1], ["FU", 12, [0, 1, 2, 3]], ["AN", 12, 0, 5], ["FU", 12, [1, 2, 3, 4]], ["AN", 12, 1, 4], ["FU", 12, [2, 3, 4, 5]], ["AN", 12, 2, 6], ["FU", 4, [0, 1, 2, 3]], ["SP", 4, 0, 588, [1], 1], ["AN", 4, 1, 2], ["FFSP", 4, 0, [6, 5, 4, 3], 1, 1], ["AN", 4, 1, 6], ["FU", 2, [0, 1, 2, 3]], ["SP", 2, 0, 507, [1], 1], ["AN", 2, 1, 2], ["FFSP", 2, 0, [6, 5, 4, 3], 1, 1], ["AN", 2, 1, 6], ["PR", 5, 0, "auto_unroll_max_step$1024"]]]], "r": [[8.56882e-05], 0, 4.38461, 1628016544], "v": "v0.6"}
{"i": [["[\"254e44c32ef688b0884d158c1b90abc6\", 1, 3, 230, 230, 64, 3, 7, 7, 1, 64, 1, 1, 1, 64, 1, 1, 1, 64, 1, 1, 1, 64, 112, 112]", "cuda -keys=cuda,gpu -max_num_threads=1024 -thread_warp_size=32", [-1, 16, 64, 49152, 2147483647, 1024, 8, 32], "", 0, []], [[], [["CI", 9], ["CI", 7], ["CI", 5], ["SP", 3, 0, 1, [1, 1, 1, 1], 1], ["SP", 3, 5, 64, [2, 2, 2, 4], 1], ["SP", 3, 10, 112, [2, 2, 2, 1], 1], ["SP", 3, 15, 112, [1, 14, 1, 8], 1], ["SP", 3, 20, 3, [1, 3], 1], ["SP", 3, 23, 7, [1, 1], 1], ["SP", 3, 26, 7, [7, 1], 1], ["RE", 3, [0, 5, 10, 15, 1, 6, 11, 16, 2, 7, 12, 17, 20, 23, 26, 21, 24, 27, 3, 8, 13, 18, 22, 25, 28, 4, 9, 14, 19]], ["FSP", 10, 0, 3, 3], ["FSP", 10, 4, 4, 3], ["FSP", 10, 8, 5, 3], ["FSP", 10, 12, 6, 3], ["RE", 10, [0, 4, 8, 12, 1, 5, 9, 13, 2, 6, 10, 14, 3, 7, 11, 15]], ["CA", 3, 10, 11], ["CHR", 2, "shared", [3]], ["CA", 3, 4, 14], ["CHR", 1, "shared", [4]], ["CA", 2, 5, 14], ["CI", 1], ["FU", 12, [0, 1, 2, 3]], ["AN", 12, 0, 5], ["FU", 12, [1, 2, 3, 4]], ["AN", 12, 1, 4], ["FU", 12, [2, 3, 4, 5]], ["AN", 12, 2, 6], ["FU", 4, [0, 1, 2, 3]], ["SP", 4, 0, 56, [1], 1], ["AN", 4, 1, 2], ["FFSP", 4, 0, [6, 5, 4, 3], 1, 1], ["AN", 4, 1, 6], ["FU", 2, [0, 1, 2, 3]], ["SP", 2, 0, 63, [1], 1], ["AN", 2, 1, 2], ["FFSP", 2, 0, [6, 5, 4, 3], 1, 1], ["AN", 2, 1, 6], ["PR", 5, 0, "auto_unroll_max_step$512"]]]], "r": [[0.000509588], 0, 5.86564, 1628016546], "v": "v0.6"}
{"i": [["[\"254e44c32ef688b0884d158c1b90abc6\", 1, 3, 230, 230, 64, 3, 7, 7, 1, 64, 1, 1, 1, 64, 1, 1, 1, 64, 1, 1, 1, 64, 112, 112]", "cuda -keys=cuda,gpu -max_num_threads=1024 -thread_warp_size=32", [-1, 16, 64, 49152, 2147483647, 1024, 8, 32], "", 0, []], [[], [["CI", 9], ["CI", 7], ["CI", 5], ["SP", 3, 0, 1, [1, 1, 1, 1], 1], ["SP", 3, 5, 64, [1, 2, 4, 8], 1], ["SP", 3, 10, 112, [1, 8, 2, 1], 1], ["SP", 3, 15, 112, [4, 2, 1, 7], 1], ["SP", 3, 20, 3, [3, 1], 1], ["SP", 3, 23, 7, [1, 1], 1], ["SP", 3, 26, 7, [1, 1], 1], ["RE", 3, [0, 5, 10, 15, 1, 6, 11, 16, 2, 7, 12, 17, 20, 23, 26, 21, 24, 27, 3, 8, 13, 18, 22, 25, 28, 4, 9, 14, 19]], ["FSP", 10, 0, 3, 3], ["FSP", 10, 4, 4, 3], ["FSP", 10, 8, 5, 3], ["FSP", 10, 12, 6, 3], ["RE", 10, [0, 4, 8, 12, 1, 5, 9, 13, 2, 6, 10, 14, 3, 7, 11, 15]], ["CA", 3, 10, 11], ["CHR", 2, "shared", [3]], ["CA", 3, 4, 14], ["CHR", 1, "shared", [4]], ["CA", 2, 5, 14], ["CI", 1], ["FU", 12, [0, 1, 2, 3]], ["AN", 12, 0, 5], ["FU", 12, [1, 2, 3, 4]], ["AN", 12, 1, 4], ["FU", 12, [2, 3, 4, 5]], ["AN", 12, 2, 6], ["FU", 4, [0, 1, 2, 3]], ["SP", 4, 0, 48, [1], 1], ["AN", 4, 1, 2], ["FFSP", 4, 0, [6, 5, 4, 3], 1, 1], ["AN", 4, 1, 6], ["FU", 2, [0, 1, 2, 3]], ["SP", 2, 0, 117, [1], 1], ["AN", 2, 1, 2], ["FFSP", 2, 0, [6, 5, 4, 3], 1, 1], ["AN", 2, 1, 6], ["PR", 5, 0, "auto_unroll_max_step$512"]]]], "r": [[0.00616202], 0, 8.83416, 1628016548], "v": "v0.6"}
{"i": [["[\"254e44c32ef688b0884d158c1b90abc6\", 1, 3, 230, 230, 64, 3, 7, 7, 1, 64, 1, 1, 1, 64, 1, 1, 1, 64, 1, 1, 1, 64, 112, 112]", "cuda -keys=cuda,gpu -max_num_threads=1024 -thread_warp_size=32", [-1, 16, 64, 49152, 2147483647, 1024, 8, 32], "", 0, []], [[], [["CI", 9], ["CI", 7], ["CI", 5], ["SP", 3, 0, 1, [1, 1, 1, 1], 1], ["SP", 3, 5, 64, [1, 8, 1, 2], 1], ["SP", 3, 10, 112, [1, 2, 8, 1], 1], ["SP", 3, 15, 112, [1, 8, 1, 1], 1], ["SP", 3, 20, 3, [3, 1], 1], ["SP", 3, 23, 7, [1, 1], 1], ["SP", 3, 26, 7, [7, 1], 1], ["RE", 3, [0, 5, 10, 15, 1, 6, 11, 16, 2, 7, 12, 17, 20, 23, 26, 21, 24, 27, 3, 8, 13, 18, 22, 25, 28, 4, 9, 14, 19]], ["FSP", 10, 0, 3, 3], ["FSP", 10, 4, 4, 3], ["FSP", 10, 8, 5, 3], ["FSP", 10, 12, 6, 3], ["RE", 10, [0, 4, 8, 12, 1, 5, 9, 13, 2, 6, 10, 14, 3, 7, 11, 15]], ["CA", 3, 10, 11], ["CHR", 2, "shared", [3]], ["CA", 3, 4, 14], ["CHR", 1, "shared", [4]], ["CA", 2, 5, 14], ["CI", 1], ["FU", 12, [0, 1, 2, 3]], ["AN", 12, 0, 5], ["FU", 12, [1, 2, 3, 4]], ["AN", 12, 1, 4], ["FU", 12, [2, 3, 4, 5]], ["AN", 12, 2, 6], ["FU", 4, [0, 1, 2, 3]], ["SP", 4, 0, 294, [1], 1], ["AN", 4, 1, 2], ["FFSP", 4, 0, [6, 5, 4, 3], 1, 1], ["AN", 4, 1, 6], ["FU", 2, [0, 1, 2, 3]], ["SP", 2, 0, 567, [1], 1], ["AN", 2, 1, 2], ["FFSP", 2, 0, [6, 5, 4, 3], 1, 1], ["AN", 2, 1, 6], ["PR", 5, 0, "auto_unroll_max_step$512"]]]], "r": [[3.43457e-05], 0, 2.21886, 1628016550], "v": "v0.6"}
{"i": [["[\"254e44c32ef688b0884d158c1b90abc6\", 1, 3, 230, 230, 64, 3, 7, 7, 1, 64, 1, 1, 1, 64, 1, 1, 1, 64, 1, 1, 1, 64, 112, 112]", "cuda -keys=cuda,gpu -max_num_threads=1024 -thread_warp_size=32", [-1, 16, 64, 49152, 2147483647, 1024, 8, 32], "", 0, []], [[], [["CI", 9], ["CI", 7], ["CI", 5], ["SP", 3, 0, 1, [1, 1, 1, 1], 1], ["SP", 3, 5, 64, [4, 16, 1, 1], 1], ["SP", 3, 10, 112, [1, 14, 1, 1], 1], ["SP", 3, 15, 112, [1, 1, 8, 1], 1], ["SP", 3, 20, 3, [3, 1], 1], ["SP", 3, 23, 7, [1, 1], 1], ["SP", 3, 26, 7, [1, 7], 1], ["RE", 3, [0, 5, 10, 15, 1, 6, 11, 16, 2, 7, 12, 17, 20, 23, 26, 21, 24, 27, 3, 8, 13, 18, 22, 25, 28, 4, 9, 14, 19]], ["FSP", 10, 0, 3, 3], ["FSP", 10, 4, 4, 3], ["FSP", 10, 8, 5, 3], ["FSP", 10, 12, 6, 3], ["RE", 10, [0, 4, 8, 12, 1, 5, 9, 13, 2, 6, 10, 14, 3, 7, 11, 15]], ["CA", 3, 10, 11], ["CHR", 2, "shared", [3]], ["CA", 3, 4, 14], ["CHR", 1, "shared", [4]], ["CA", 2, 5, 14], ["CI", 1], ["FU", 12, [0, 1, 2, 3]], ["AN", 12, 0, 5], ["FU", 12, [1, 2, 3, 4]], ["AN", 12, 1, 4], ["FU", 12, [2, 3, 4, 5]], ["AN", 12, 2, 6], ["FU", 4, [0, 1, 2, 3]], ["SP", 4, 0, 84, [1], 1], ["AN", 4, 1, 2], ["FFSP", 4, 0, [6, 5, 4, 3], 1, 1], ["AN", 4, 1, 6], ["FU", 2, [0, 1, 2, 3]], ["SP", 2, 0, 63, [1], 1], ["AN", 2, 1, 2], ["FFSP", 2, 0, [6, 5, 4, 3], 1, 1], ["AN", 2, 1, 6], ["PR", 5, 0, "auto_unroll_max_step$0"]]]], "r": [[6.20301e-05], 0, 1.81048, 1628016551], "v": "v0.6"}
{"i": [["[\"254e44c32ef688b0884d158c1b90abc6\", 1, 3, 230, 230, 64, 3, 7, 7, 1, 64, 1, 1, 1, 64, 1, 1, 1, 64, 1, 1, 1, 64, 112, 112]", "cuda -keys=cuda,gpu -max_num_threads=1024 -thread_warp_size=32", [-1, 16, 64, 49152, 2147483647, 1024, 8, 32], "", 0, []], [[], [["CI", 9], ["CI", 7], ["CI", 5], ["SP", 3, 0, 1, [1, 1, 1, 1], 1], ["SP", 3, 5, 64, [8, 2, 1, 1], 1], ["SP", 3, 10, 112, [1, 8, 1, 1], 1], ["SP", 3, 15, 112, [1, 2, 2, 14], 1], ["SP", 3, 20, 3, [3, 1], 1], ["SP", 3, 23, 7, [1, 7], 1], ["SP", 3, 26, 7, [1, 1], 1], ["RE", 3, [0, 5, 10, 15, 1, 6, 11, 16, 2, 7, 12, 17, 20, 23, 26, 21, 24, 27, 3, 8, 13, 18, 22, 25, 28, 4, 9, 14, 19]], ["FSP", 10, 0, 3, 3], ["FSP", 10, 4, 4, 3], ["FSP", 10, 8, 5, 3], ["FSP", 10, 12, 6, 3], ["RE", 10, [0, 4, 8, 12, 1, 5, 9, 13, 2, 6, 10, 14, 3, 7, 11, 15]], ["CA", 3, 10, 11], ["CHR", 2, "shared", [3]], ["CA", 3, 4, 14], ["CHR", 1, "shared", [4]], ["CA", 2, 5, 14], ["CI", 1], ["FU", 12, [0, 1, 2, 3]], ["AN", 12, 0, 5], ["FU", 12, [1, 2, 3, 4]], ["AN", 12, 1, 4], ["FU", 12, [2, 3, 4, 5]], ["AN", 12, 2, 6], ["FU", 4, [0, 1, 2, 3]], ["SP", 4, 0, 168, [1], 1], ["AN", 4, 1, 2], ["FFSP", 4, 0, [6, 5, 4, 3], 1, 1], ["AN", 4, 1, 6], ["FU", 2, [0, 1, 2, 3]], ["SP", 2, 0, 1155, [1], 1], ["AN", 2, 1, 2], ["FFSP", 2, 0, [6, 5, 4, 3], 1, 1], ["AN", 2, 1, 6], ["PR", 5, 0, "auto_unroll_max_step$1024"]]]], "r": [[0.000287927], 0, 6.06725, 1628016553], "v": "v0.6"}
{"i": [["[\"254e44c32ef688b0884d158c1b90abc6\", 1, 3, 230, 230, 64, 3, 7, 7, 1, 64, 1, 1, 1, 64, 1, 1, 1, 64, 1, 1, 1, 64, 112, 112]", "cuda -keys=cuda,gpu -max_num_threads=1024 -thread_warp_size=32", [-1, 16, 64, 49152, 2147483647, 1024, 8, 32], "", 0, []], [[], [["CI", 9], ["CI", 7], ["CI", 5], ["SP", 3, 0, 1, [1, 1, 1, 1], 1], ["SP", 3, 5, 64, [2, 2, 1, 8], 1], ["SP", 3, 10, 112, [2, 28, 1, 2], 1], ["SP", 3, 15, 112, [1, 2, 1, 2], 1], ["SP", 3, 20, 3, [3, 1], 1], ["SP", 3, 23, 7, [7, 1], 1], ["SP", 3, 26, 7, [1, 1], 1], ["RE", 3, [0, 5, 10, 15, 1, 6, 11, 16, 2, 7, 12, 17, 20, 23, 26, 21, 24, 27, 3, 8, 13, 18, 22, 25, 28, 4, 9, 14, 19]], ["FSP", 10, 0, 3, 3], ["FSP", 10, 4, 4, 3], ["FSP", 10, 8, 5, 3], ["FSP", 10, 12, 6, 3], ["RE", 10, [0, 4, 8, 12, 1, 5, 9, 13, 2, 6, 10, 14, 3, 7, 11, 15]], ["CA", 3, 10, 11], ["CHR", 2, "shared", [3]], ["CA", 3, 4, 14], ["CHR", 1, "shared", [4]], ["CA", 2, 5, 14], ["CI", 1], ["FU", 12, [0, 1, 2, 3]], ["AN", 12, 0, 5], ["FU", 12, [1, 2, 3, 4]], ["AN", 12, 1, 4], ["FU", 12, [2, 3, 4, 5]], ["AN", 12, 2, 6], ["FU", 4, [0, 1, 2, 3]], ["SP", 4, 0, 56, [1], 1], ["AN", 4, 1, 2], ["FFSP", 4, 0, [6, 5, 4, 3], 1, 1], ["AN", 4, 1, 6], ["FU", 2, [0, 1, 2, 3]], ["SP", 2, 0, 63, [63], 1], ["AN", 2, 1, 2], ["FFSP", 2, 0, [6, 5, 4, 3], 1, 1], ["AN", 2, 1, 6], ["PR", 5, 0, "auto_unroll_max_step$512"]]]], "r": [[9.55661e-05], 0, 2.43338, 1628016554], "v": "v0.6"}
{"i": [["[\"254e44c32ef688b0884d158c1b90abc6\", 1, 3, 230, 230, 64, 3, 7, 7, 1, 64, 1, 1, 1, 64, 1, 1, 1, 64, 1, 1, 1, 64, 112, 112]", "cuda -keys=cuda,gpu -max_num_threads=1024 -thread_warp_size=32", [-1, 16, 64, 49152, 2147483647, 1024, 8, 32], "", 0, []], [[], [["CI", 9], ["CI", 7], ["CI", 5], ["SP", 3, 0, 1, [1, 1, 1, 1], 1], ["SP", 3, 5, 64, [4, 4, 1, 2], 1], ["SP", 3, 10, 112, [2, 8, 1, 7], 1], ["SP", 3, 15, 112, [1, 1, 2, 2], 1], ["SP", 3, 20, 3, [1, 1], 1], ["SP", 3, 23, 7, [1, 1], 1], ["SP", 3, 26, 7, [1, 1], 1], ["RE", 3, [0, 5, 10, 15, 1, 6, 11, 16, 2, 7, 12, 17, 20, 23, 26, 21, 24, 27, 3, 8, 13, 18, 22, 25, 28, 4, 9, 14, 19]], ["FSP", 10, 0, 3, 3], ["FSP", 10, 4, 4, 3], ["FSP", 10, 8, 5, 3], ["FSP", 10, 12, 6, 3], ["RE", 10, [0, 4, 8, 12, 1, 5, 9, 13, 2, 6, 10, 14, 3, 7, 11, 15]], ["CA", 3, 10, 11], ["CHR", 2, "shared", [3]], ["CA", 3, 4, 14], ["CHR", 1, "shared", [4]], ["CA", 2, 5, 14], ["CI", 1], ["FU", 12, [0, 1, 2, 3]], ["AN", 12, 0, 5], ["FU", 12, [1, 2, 3, 4]], ["AN", 12, 1, 4], ["FU", 12, [2, 3, 4, 5]], ["AN", 12, 2, 6], ["FU", 4, [0, 1, 2, 3]], ["SP", 4, 0, 42, [1], 1], ["AN", 4, 1, 2], ["FFSP", 4, 0, [6, 5, 4, 3], 1, 1], ["AN", 4, 1, 6], ["FU", 2, [0, 1, 2, 3]], ["SP", 2, 0, 399, [1], 1], ["AN", 2, 1, 2], ["FFSP", 2, 0, [6, 5, 4, 3], 1, 1], ["AN", 2, 1, 6], ["PR", 5, 0, "auto_unroll_max_step$1024"]]]], "r": [[0.00110406], 0, 4.11386, 1628016555], "v": "v0.6"}
{"i": [["[\"254e44c32ef688b0884d158c1b90abc6\", 1, 3, 230, 230, 64, 3, 7, 7, 1, 64, 1, 1, 1, 64, 1, 1, 1, 64, 1, 1, 1, 64, 112, 112]", "cuda -keys=cuda,gpu -max_num_threads=1024 -thread_warp_size=32", [-1, 16, 64, 49152, 2147483647, 1024, 8, 32], "", 0, []], [[], [["CI", 9], ["CI", 7], ["CI", 5], ["SP", 3, 0, 1, [1, 1, 1, 1], 1], ["SP", 3, 5, 64, [1, 16, 1, 2], 1], ["SP", 3, 10, 112, [2, 4, 14, 1], 1], ["SP", 3, 15, 112, [4, 1, 1, 1], 1], ["SP", 3, 20, 3, [1, 1], 1], ["SP", 3, 23, 7, [1, 7], 1], ["SP", 3, 26, 7, [7, 1], 1], ["RE", 3, [0, 5, 10, 15, 1, 6, 11, 16, 2, 7, 12, 17, 20, 23, 26, 21, 24, 27, 3, 8, 13, 18, 22, 25, 28, 4, 9, 14, 19]], ["FSP", 10, 0, 3, 3], ["FSP", 10, 4, 4, 3], ["FSP", 10, 8, 5, 3], ["FSP", 10, 12, 6, 3], ["RE", 10, [0, 4, 8, 12, 1, 5, 9, 13, 2, 6, 10, 14, 3, 7, 11, 15]], ["CA", 3, 10, 11], ["CHR", 2, "shared", [3]], ["CA", 3, 4, 14], ["CHR", 1, "shared", [4]], ["CA", 2, 5, 14], ["CI", 1], ["FU", 12, [0, 1, 2, 3]], ["AN", 12, 0, 5], ["FU", 12, [1, 2, 3, 4]], ["AN", 12, 1, 4], ["FU", 12, [2, 3, 4, 5]], ["AN", 12, 2, 6], ["FU", 4, [0, 1, 2, 3]], ["SP", 4, 0, 98, [1], 1], ["AN", 4, 1, 2], ["FFSP", 4, 0, [6, 5, 4, 3], 1, 1], ["AN", 4, 1, 6], ["FU", 2, [0, 1, 2, 3]], ["SP", 2, 0, 231, [33], 1], ["AN", 2, 1, 2], ["FFSP", 2, 0, [6, 5, 4, 3], 1, 1], ["AN", 2, 1, 6], ["PR", 5, 0, "auto_unroll_max_step$64"]]]], "r": [[0.000159107], 0, 3.08907, 1628016557], "v": "v0.6"}
{"i": [["[\"254e44c32ef688b0884d158c1b90abc6\", 1, 3, 230, 230, 64, 3, 7, 7, 1, 64, 1, 1, 1, 64, 1, 1, 1, 64, 1, 1, 1, 64, 112, 112]", "cuda -keys=cuda,gpu -max_num_threads=1024 -thread_warp_size=32", [-1, 16, 64, 49152, 2147483647, 1024, 8, 32], "", 0, []], [[], [["CI", 9], ["CI", 7], ["CI", 5], ["SP", 3, 0, 1, [1, 1, 1, 1], 1], ["SP", 3, 5, 64, [2, 8, 1, 2], 1], ["SP", 3, 10, 112, [1, 1, 16, 7], 1], ["SP", 3, 15, 112, [1, 7, 2, 1], 1], ["SP", 3, 20, 3, [1, 1], 1], ["SP", 3, 23, 7, [1, 7], 1], ["SP", 3, 26, 7, [7, 1], 1], ["RE", 3, [0, 5, 10, 15, 1, 6, 11, 16, 2, 7, 12, 17, 20, 23, 26, 21, 24, 27, 3, 8, 13, 18, 22, 25, 28, 4, 9, 14, 19]], ["FSP", 10, 0, 3, 3], ["FSP", 10, 4, 4, 3], ["FSP", 10, 8, 5, 3], ["FSP", 10, 12, 6, 3], ["RE", 10, [0, 4, 8, 12, 1, 5, 9, 13, 2, 6, 10, 14, 3, 7, 11, 15]], ["CA", 3, 10, 11], ["CHR", 2, "shared", [3]], ["CA", 3, 4, 14], ["CHR", 1, "shared", [4]], ["CA", 2, 5, 14], ["CI", 1], ["FU", 12, [0, 1, 2, 3]], ["AN", 12, 0, 5], ["FU", 12, [1, 2, 3, 4]], ["AN", 12, 1, 4], ["FU", 12, [2, 3, 4, 5]], ["AN", 12, 2, 6], ["FU", 4, [0, 1, 2, 3]], ["SP", 4, 0, 14, [1], 1], ["AN", 4, 1, 2], ["FFSP", 4, 0, [6, 5, 4, 3], 1, 1], ["AN", 4, 1, 6], ["FU", 2, [0, 1, 2, 3]], ["SP", 2, 0, 687, [1], 1], ["AN", 2, 1, 2], ["FFSP", 2, 0, [6, 5, 4, 3], 1, 1], ["AN", 2, 1, 6], ["PR", 5, 0, "auto_unroll_max_step$1024"]]]], "r": [[0.00035973], 0, 3.99835, 1628016558], "v": "v0.6"}
{"i": [["[\"254e44c32ef688b0884d158c1b90abc6\", 1, 3, 230, 230, 64, 3, 7, 7, 1, 64, 1, 1, 1, 64, 1, 1, 1, 64, 1, 1, 1, 64, 112, 112]", "cuda -keys=cuda,gpu -max_num_threads=1024 -thread_warp_size=32", [-1, 16, 64, 49152, 2147483647, 1024, 8, 32], "", 0, []], [[], [["CI", 9], ["CI", 7], ["CI", 5], ["SP", 3, 0, 1, [1, 1, 1, 1], 1], ["SP", 3, 5, 64, [4, 2, 1, 4], 1], ["SP", 3, 10, 112, [1, 28, 1, 2], 1], ["SP", 3, 15, 112, [1, 1, 7, 1], 1], ["SP", 3, 20, 3, [1, 1], 1], ["SP", 3, 23, 7, [1, 1], 1], ["SP", 3, 26, 7, [7, 1], 1], ["RE", 3, [0, 5, 10, 15, 1, 6, 11, 16, 2, 7, 12, 17, 20, 23, 26, 21, 24, 27, 3, 8, 13, 18, 22, 25, 28, 4, 9, 14, 19]], ["FSP", 10, 0, 3, 3], ["FSP", 10, 4, 4, 3], ["FSP", 10, 8, 5, 3], ["FSP", 10, 12, 6, 3], ["RE", 10, [0, 4, 8, 12, 1, 5, 9, 13, 2, 6, 10, 14, 3, 7, 11, 15]], ["CA", 3, 10, 11], ["CHR", 2, "shared", [3]], ["CA", 3, 4, 14], ["CHR", 1, "shared", [4]], ["CA", 2, 5, 14], ["CI", 1], ["FU", 12, [0, 1, 2, 3]], ["AN", 12, 0, 5], ["FU", 12, [1, 2, 3, 4]], ["AN", 12, 1, 4], ["FU", 12, [2, 3, 4, 5]], ["AN", 12, 2, 6], ["FU", 4, [0, 1, 2, 3]], ["SP", 4, 0, 84, [1], 1], ["AN", 4, 1, 2], ["FFSP", 4, 0, [6, 5, 4, 3], 1, 1], ["AN", 4, 1, 6], ["FU", 2, [0, 1, 2, 3]], ["SP", 2, 0, 171, [3], 1], ["AN", 2, 1, 2], ["FFSP", 2, 0, [6, 5, 4, 3], 1, 1], ["AN", 2, 1, 6], ["PR", 5, 0, "auto_unroll_max_step$512"]]]], "r": [[0.000151498], 0, 2.67624, 1628016559], "v": "v0.6"}
{"i": [["[\"254e44c32ef688b0884d158c1b90abc6\", 1, 3, 230, 230, 64, 3, 7, 7, 1, 64, 1, 1, 1, 64, 1, 1, 1, 64, 1, 1, 1, 64, 112, 112]", "cuda -keys=cuda,gpu -max_num_threads=1024 -thread_warp_size=32", [-1, 16, 64, 49152, 2147483647, 1024, 8, 32], "", 0, []], [[], [["CI", 9], ["CI", 7], ["CI", 5], ["SP", 3, 0, 1, [1, 1, 1, 1], 1], ["SP", 3, 5, 64, [1, 16, 1, 2], 1], ["SP", 3, 10, 112, [1, 8, 2, 1], 1], ["SP", 3, 15, 112, [7, 1, 2, 2], 1], ["SP", 3, 20, 3, [1, 3], 1], ["SP", 3, 23, 7, [7, 1], 1], ["SP", 3, 26, 7, [1, 7], 1], ["RE", 3, [0, 5, 10, 15, 1, 6, 11, 16, 2, 7, 12, 17, 20, 23, 26, 21, 24, 27, 3, 8, 13, 18, 22, 25, 28, 4, 9, 14, 19]], ["FSP", 10, 0, 3, 3], ["FSP", 10, 4, 4, 3], ["FSP", 10, 8, 5, 3], ["FSP", 10, 12, 6, 3], ["RE", 10, [0, 4, 8, 12, 1, 5, 9, 13, 2, 6, 10, 14, 3, 7, 11, 15]], ["CA", 3, 10, 11], ["CHR", 2, "shared", [3]], ["CA", 3, 4, 14], ["CHR", 1, "shared", [4]], ["CA", 2, 5, 14], ["CI", 1], ["FU", 12, [0, 1, 2, 3]], ["AN", 12, 0, 5], ["FU", 12, [1, 2, 3, 4]], ["AN", 12, 1, 4], ["FU", 12, [2, 3, 4, 5]], ["AN", 12, 2, 6], ["FU", 4, [0, 1, 2, 3]], ["SP", 4, 0, 42, [1], 1], ["AN", 4, 1, 2], ["FFSP", 4, 0, [6, 5, 4, 3], 1, 1], ["AN", 4, 1, 6], ["FU", 2, [0, 1, 2, 3]], ["SP", 2, 0, 117, [1], 1], ["AN", 2, 1, 2], ["FFSP", 2, 0, [6, 5, 4, 3], 1, 1], ["AN", 2, 1, 6], ["PR", 5, 0, "auto_unroll_max_step$64"]]]], "r": [[8.01014e-05], 0, 2.186, 1628016567], "v": "v0.6"}
{"i": [["[\"254e44c32ef688b0884d158c1b90abc6\", 1, 3, 230, 230, 64, 3, 7, 7, 1, 64, 1, 1, 1, 64, 1, 1, 1, 64, 1, 1, 1, 64, 112, 112]", "cuda -keys=cuda,gpu -max_num_threads=1024 -thread_warp_size=32", [-1, 16, 64, 49152, 2147483647, 1024, 8, 32], "", 0, []], [[], [["CI", 9], ["CI", 7], ["CI", 5], ["SP", 3, 0, 1, [1, 1, 1, 1], 1], ["SP", 3, 5, 64, [1, 4, 4, 4], 1], ["SP", 3, 10, 112, [1, 1, 1, 4], 1], ["SP", 3, 15, 112, [8, 7, 2, 1], 1], ["SP", 3, 20, 3, [1, 1], 1], ["SP", 3, 23, 7, [1, 7], 1], ["SP", 3, 26, 7, [1, 1], 1], ["RE", 3, [0, 5, 10, 15, 1, 6, 11, 16, 2, 7, 12, 17, 20, 23, 26, 21, 24, 27, 3, 8, 13, 18, 22, 25, 28, 4, 9, 14, 19]], ["FSP", 10, 0, 3, 3], ["FSP", 10, 4, 4, 3], ["FSP", 10, 8, 5, 3], ["FSP", 10, 12, 6, 3], ["RE", 10, [0, 4, 8, 12, 1, 5, 9, 13, 2, 6, 10, 14, 3, 7, 11, 15]], ["CA", 3, 10, 11], ["CHR", 2, "shared", [3]], ["CA", 3, 4, 14], ["CHR", 1, "shared", [4]], ["CA", 2, 5, 14], ["CI", 1], ["FU", 12, [0, 1, 2, 3]], ["AN", 12, 0, 5], ["FU", 12, [1, 2, 3, 4]], ["AN", 12, 1, 4], ["FU", 12, [2, 3, 4, 5]], ["AN", 12, 2, 6], ["FU", 4, [0, 1, 2, 3]], ["SP", 4, 0, 336, [1], 1], ["AN", 4, 1, 2], ["FFSP", 4, 0, [6, 5, 4, 3], 1, 1], ["AN", 4, 1, 6], ["FU", 2, [0, 1, 2, 3]], ["SP", 2, 0, 81, [1], 1], ["AN", 2, 1, 2], ["FFSP", 2, 0, [6, 5, 4, 3], 1, 1], ["AN", 2, 1, 6], ["PR", 5, 0, "auto_unroll_max_step$16"]]]], "r": [[0.000693898], 0, 2.50893, 1628016569], "v": "v0.6"}
{"i": [["[\"254e44c32ef688b0884d158c1b90abc6\", 1, 3, 230, 230, 64, 3, 7, 7, 1, 64, 1, 1, 1, 64, 1, 1, 1, 64, 1, 1, 1, 64, 112, 112]", "cuda -keys=cuda,gpu -max_num_threads=1024 -thread_warp_size=32", [-1, 16, 64, 49152, 2147483647, 1024, 8, 32], "", 0, []], [[], [["CI", 9], ["CI", 7], ["CI", 5], ["SP", 3, 0, 1, [1, 1, 1, 1], 1], ["SP", 3, 5, 64, [1, 8, 1, 4], 1], ["SP", 3, 10, 112, [2, 4, 14, 1], 1], ["SP", 3, 15, 112, [1, 1, 2, 4], 1], ["SP", 3, 20, 3, [1, 3], 1], ["SP", 3, 23, 7, [1, 1], 1], ["SP", 3, 26, 7, [1, 1], 1], ["RE", 3, [0, 5, 10, 15, 1, 6, 11, 16, 2, 7, 12, 17, 20, 23, 26, 21, 24, 27, 3, 8, 13, 18, 22, 25, 28, 4, 9, 14, 19]], ["FSP", 10, 0, 3, 3], ["FSP", 10, 4, 4, 3], ["FSP", 10, 8, 5, 3], ["FSP", 10, 12, 6, 3], ["RE", 10, [0, 4, 8, 12, 1, 5, 9, 13, 2, 6, 10, 14, 3, 7, 11, 15]], ["CA", 3, 10, 11], ["CHR", 2, "shared", [3]], ["CA", 3, 4, 14], ["CHR", 1, "shared", [4]], ["CA", 2, 5, 14], ["CI", 1], ["FU", 12, [0, 1, 2, 3]], ["AN", 12, 0, 5], ["FU", 12, [1, 2, 3, 4]], ["AN", 12, 1, 4], ["FU", 12, [2, 3, 4, 5]], ["AN", 12, 2, 6], ["FU", 4, [0, 1, 2, 3]], ["SP", 4, 0, 84, [4], 1], ["AN", 4, 1, 2], ["FFSP", 4, 0, [6, 5, 4, 3], 1, 1], ["AN", 4, 1, 6], ["FU", 2, [0, 1, 2, 3]], ["SP", 2, 0, 1485, [1], 1], ["AN", 2, 1, 2], ["FFSP", 2, 0, [6, 5, 4, 3], 1, 1], ["AN", 2, 1, 6], ["PR", 5, 0, "auto_unroll_max_step$512"]]]], "r": [[0.00151856], 0, 5.10131, 1628016570], "v": "v0.6"}
{"i": [["[\"254e44c32ef688b0884d158c1b90abc6\", 1, 3, 230, 230, 64, 3, 7, 7, 1, 64, 1, 1, 1, 64, 1, 1, 1, 64, 1, 1, 1, 64, 112, 112]", "cuda -keys=cuda,gpu -max_num_threads=1024 -thread_warp_size=32", [-1, 16, 64, 49152, 2147483647, 1024, 8, 32], "", 0, []], [[], [["CI", 9], ["CI", 7], ["CI", 5], ["SP", 3, 0, 1, [1, 1, 1, 1], 1], ["SP", 3, 5, 64, [1, 16, 1, 2], 1], ["SP", 3, 10, 112, [1, 1, 2, 8], 1], ["SP", 3, 15, 112, [4, 7, 1, 4], 1], ["SP", 3, 20, 3, [1, 1], 1], ["SP", 3, 23, 7, [7, 1], 1], ["SP", 3, 26, 7, [7, 1], 1], ["RE", 3, [0, 5, 10, 15, 1, 6, 11, 16, 2, 7, 12, 17, 20, 23, 26, 21, 24, 27, 3, 8, 13, 18, 22, 25, 28, 4, 9, 14, 19]], ["FSP", 10, 0, 3, 3], ["FSP", 10, 4, 4, 3], ["FSP", 10, 8, 5, 3], ["FSP", 10, 12, 6, 3], ["RE", 10, [0, 4, 8, 12, 1, 5, 9, 13, 2, 6, 10, 14, 3, 7, 11, 15]], ["CA", 3, 10, 11], ["CHR", 2, "shared", [3]], ["CA", 3, 4, 14], ["CHR", 1, "shared", [4]], ["CA", 2, 5, 14], ["CI", 1], ["FU", 12, [0, 1, 2, 3]], ["AN", 12, 0, 5], ["FU", 12, [1, 2, 3, 4]], ["AN", 12, 1, 4], ["FU", 12, [2, 3, 4, 5]], ["AN", 12, 2, 6], ["FU", 4, [0, 1, 2, 3]], ["SP", 4, 0, 14, [1], 1], ["AN", 4, 1, 2], ["FFSP", 4, 0, [6, 5, 4, 3], 1, 1], ["AN", 4, 1, 6], ["FU", 2, [0, 1, 2, 3]], ["SP", 2, 0, 259, [7], 1], ["AN", 2, 1, 2], ["FFSP", 2, 0, [6, 5, 4, 3], 1, 1], ["AN", 2, 1, 6], ["PR", 5, 0, "auto_unroll_max_step$16"]]]], "r": [[0.00133146], 0, 2.66171, 1628016572], "v": "v0.6"}
{"i": [["[\"254e44c32ef688b0884d158c1b90abc6\", 1, 3, 230, 230, 64, 3, 7, 7, 1, 64, 1, 1, 1, 64, 1, 1, 1, 64, 1, 1, 1, 64, 112, 112]", "cuda -keys=cuda,gpu -max_num_threads=1024 -thread_warp_size=32", [-1, 16, 64, 49152, 2147483647, 1024, 8, 32], "", 0, []], [[], [["CI", 9], ["CI", 7], ["CI", 5], ["SP", 3, 0, 1, [1, 1, 1, 1], 1], ["SP", 3, 5, 64, [2, 8, 1, 2], 1], ["SP", 3, 10, 112, [1, 1, 16, 7], 1], ["SP", 3, 15, 112, [1, 7, 2, 1], 1], ["SP", 3, 20, 3, [1, 1], 1], ["SP", 3, 23, 7, [7, 1], 1], ["SP", 3, 26, 7, [7, 1], 1], ["RE", 3, [0, 5, 10, 15, 1, 6, 11, 16, 2, 7, 12, 17, 20, 23, 26, 21, 24, 27, 3, 8, 13, 18, 22, 25, 28, 4, 9, 14, 19]], ["FSP", 10, 0, 3, 3], ["FSP", 10, 4, 4, 3], ["FSP", 10, 8, 5, 3], ["FSP", 10, 12, 6, 3], ["RE", 10, [0, 4, 8, 12, 1, 5, 9, 13, 2, 6, 10, 14, 3, 7, 11, 15]], ["CA", 3, 10, 11], ["CHR", 2, "shared", [3]], ["CA", 3, 4, 14], ["CHR", 1, "shared", [4]], ["CA", 2, 5, 14], ["CI", 1], ["FU", 12, [0, 1, 2, 3]], ["AN", 12, 0, 5], ["FU", 12, [1, 2, 3, 4]], ["AN", 12, 1, 4], ["FU", 12, [2, 3, 4, 5]], ["AN", 12, 2, 6], ["FU", 4, [0, 1, 2, 3]], ["SP", 4, 0, 14, [1], 1], ["AN", 4, 1, 2], ["FFSP", 4, 0, [6, 5, 4, 3], 1, 1], ["AN", 4, 1, 6], ["FU", 2, [0, 1, 2, 3]], ["SP", 2, 0, 687, [1], 1], ["AN", 2, 1, 2], ["FFSP", 2, 0, [6, 5, 4, 3], 1, 1], ["AN", 2, 1, 6], ["PR", 5, 0, "auto_unroll_max_step$1024"]]]], "r": [[0.00225675], 0, 8.13349, 1628016573], "v": "v0.6"}
{"i": [["[\"254e44c32ef688b0884d158c1b90abc6\", 1, 3, 230, 230, 64, 3, 7, 7, 1, 64, 1, 1, 1, 64, 1, 1, 1, 64, 1, 1, 1, 64, 112, 112]", "cuda -keys=cuda,gpu -max_num_threads=1024 -thread_warp_size=32", [-1, 16, 64, 49152, 2147483647, 1024, 8, 32], "", 0, []], [[], [["CI", 9], ["CI", 7], ["CI", 5], ["SP", 3, 0, 1, [1, 1, 1, 1], 1], ["SP", 3, 5, 64, [2, 2, 4, 1], 1], ["SP", 3, 10, 112, [4, 2, 14, 1], 1], ["SP", 3, 15, 112, [1, 16, 1, 1], 1], ["SP", 3, 20, 3, [1, 1], 1], ["SP", 3, 23, 7, [1, 7], 1], ["SP", 3, 26, 7, [1, 1], 1], ["RE", 3, [0, 5, 10, 15, 1, 6, 11, 16, 2, 7, 12, 17, 20, 23, 26, 21, 24, 27, 3, 8, 13, 18, 22, 25, 28, 4, 9, 14, 19]], ["FSP", 10, 0, 3, 3], ["FSP", 10, 4, 4, 3], ["FSP", 10, 8, 5, 3], ["FSP", 10, 12, 6, 3], ["RE", 10, [0, 4, 8, 12, 1, 5, 9, 13, 2, 6, 10, 14, 3, 7, 11, 15]], ["CA", 3, 10, 11], ["CHR", 2, "shared", [3]], ["CA", 3, 4, 14], ["CHR", 1, "shared", [4]], ["CA", 2, 5, 14], ["CI", 1], ["FU", 12, [0, 1, 2, 3]], ["AN", 12, 0, 5], ["FU", 12, [1, 2, 3, 4]], ["AN", 12, 1, 4], ["FU", 12, [2, 3, 4, 5]], ["AN", 12, 2, 6], ["FU", 4, [0, 1, 2, 3]], ["SP", 4, 0, 196, [1], 1], ["AN", 4, 1, 2], ["FFSP", 4, 0, [6, 5, 4, 3], 1, 1], ["AN", 4, 1, 6], ["FU", 2, [0, 1, 2, 3]], ["SP", 2, 0, 133, [1], 1], ["AN", 2, 1, 2], ["FFSP", 2, 0, [6, 5, 4, 3], 1, 1], ["AN", 2, 1, 6], ["PR", 5, 0, "auto_unroll_max_step$64"]]]], "r": [[0.000852231], 0, 2.32198, 1628016575], "v": "v0.6"}
{"i": [["[\"254e44c32ef688b0884d158c1b90abc6\", 1, 3, 230, 230, 64, 3, 7, 7, 1, 64, 1, 1, 1, 64, 1, 1, 1, 64, 1, 1, 1, 64, 112, 112]", "cuda -keys=cuda,gpu -max_num_threads=1024 -thread_warp_size=32", [-1, 16, 64, 49152, 2147483647, 1024, 8, 32], "", 0, []], [[], [["CI", 9], ["CI", 7], ["CI", 5], ["SP", 3, 0, 1, [1, 1, 1, 1], 1], ["SP", 3, 5, 64, [1, 32, 1, 1], 1], ["SP", 3, 10, 112, [1, 1, 1, 56], 1], ["SP", 3, 15, 112, [1, 7, 1, 4], 1], ["SP", 3, 20, 3, [1, 1], 1], ["SP", 3, 23, 7, [1, 1], 1], ["SP", 3, 26, 7, [7, 1], 1], ["RE", 3, [0, 5, 10, 15, 1, 6, 11, 16, 2, 7, 12, 17, 20, 23, 26, 21, 24, 27, 3, 8, 13, 18, 22, 25, 28, 4, 9, 14, 19]], ["FSP", 10, 0, 3, 3], ["FSP", 10, 4, 4, 3], ["FSP", 10, 8, 5, 3], ["FSP", 10, 12, 6, 3], ["RE", 10, [0, 4, 8, 12, 1, 5, 9, 13, 2, 6, 10, 14, 3, 7, 11, 15]], ["CA", 3, 10, 11], ["CHR", 2, "shared", [3]], ["CA", 3, 4, 14], ["CHR", 1, "shared", [4]], ["CA", 2, 5, 14], ["CI", 1], ["FU", 12, [0, 1, 2, 3]], ["AN", 12, 0, 5], ["FU", 12, [1, 2, 3, 4]], ["AN", 12, 1, 4], ["FU", 12, [2, 3, 4, 5]], ["AN", 12, 2, 6], ["FU", 4, [0, 1, 2, 3]], ["SP", 4, 0, 49, [1], 1], ["AN", 4, 1, 2], ["FFSP", 4, 0, [6, 5, 4, 3], 1, 1], ["AN", 4, 1, 6], ["FU", 2, [0, 1, 2, 3]], ["SP", 2, 0, 429, [1], 1], ["AN", 2, 1, 2], ["FFSP", 2, 0, [6, 5, 4, 3], 1, 1], ["AN", 2, 1, 6], ["PR", 5, 0, "auto_unroll_max_step$1024"]]]], "r": [[0.000635154], 0, 2.95585, 1628016576], "v": "v0.6"}
{"i": [["[\"254e44c32ef688b0884d158c1b90abc6\", 1, 3, 230, 230, 64, 3, 7, 7, 1, 64, 1, 1, 1, 64, 1, 1, 1, 64, 1, 1, 1, 64, 112, 112]", "cuda -keys=cuda,gpu -max_num_threads=1024 -thread_warp_size=32", [-1, 16, 64, 49152, 2147483647, 1024, 8, 32], "", 0, []], [[], [["CI", 9], ["CI", 7], ["CI", 5], ["SP", 3, 0, 1, [1, 1, 1, 1], 1], ["SP", 3, 5, 64, [2, 1, 4, 1], 1], ["SP", 3, 10, 112, [7, 4, 1, 1], 1], ["SP", 3, 15, 112, [1, 8, 14, 1], 1], ["SP", 3, 20, 3, [1, 1], 1], ["SP", 3, 23, 7, [1, 1], 1], ["SP", 3, 26, 7, [1, 1], 1], ["RE", 3, [0, 5, 10, 15, 1, 6, 11, 16, 2, 7, 12, 17, 20, 23, 26, 21, 24, 27, 3, 8, 13, 18, 22, 25, 28, 4, 9, 14, 19]], ["FSP", 10, 0, 3, 3], ["FSP", 10, 4, 4, 3], ["FSP", 10, 8, 5, 3], ["FSP", 10, 12, 6, 3], ["RE", 10, [0, 4, 8, 12, 1, 5, 9, 13, 2, 6, 10, 14, 3, 7, 11, 15]], ["CA", 3, 10, 11], ["CHR", 2, "shared", [3]], ["CA", 3, 4, 14], ["CHR", 1, "shared", [4]], ["CA", 2, 5, 14], ["CI", 1], ["FU", 12, [0, 1, 2, 3]], ["AN", 12, 0, 5], ["FU", 12, [1, 2, 3, 4]], ["AN", 12, 1, 4], ["FU", 12, [2, 3, 4, 5]], ["AN", 12, 2, 6], ["FU", 4, [0, 1, 2, 3]], ["SP", 4, 0, 4, [1], 1], ["AN", 4, 1, 2], ["FFSP", 4, 0, [6, 5, 4, 3], 1, 1], ["AN", 4, 1, 6], ["FU", 2, [0, 1, 2, 3]], ["SP", 2, 0, 351, [1], 1], ["AN", 2, 1, 2], ["FFSP", 2, 0, [6, 5, 4, 3], 1, 1], ["AN", 2, 1, 6], ["PR", 5, 0, "auto_unroll_max_step$1024"]]]], "r": [[0.00359071], 0, 9.78598, 1628016579], "v": "v0.6"}
{"i": [["[\"254e44c32ef688b0884d158c1b90abc6\", 1, 3, 230, 230, 64, 3, 7, 7, 1, 64, 1, 1, 1, 64, 1, 1, 1, 64, 1, 1, 1, 64, 112, 112]", "cuda -keys=cuda,gpu -max_num_threads=1024 -thread_warp_size=32", [-1, 16, 64, 49152, 2147483647, 1024, 8, 32], "", 0, []], [[], [["CI", 9], ["CI", 7], ["CI", 5], ["SP", 3, 0, 1, [1, 1, 1, 1], 1], ["SP", 3, 5, 64, [2, 1, 1, 2], 1], ["SP", 3, 10, 112, [1, 2, 1, 7], 1], ["SP", 3, 15, 112, [1, 28, 1, 4], 1], ["SP", 3, 20, 3, [1, 1], 1], ["SP", 3, 23, 7, [1, 1], 1], ["SP", 3, 26, 7, [1, 1], 1], ["RE", 3, [0, 5, 10, 15, 1, 6, 11, 16, 2, 7, 12, 17, 20, 23, 26, 21, 24, 27, 3, 8, 13, 18, 22, 25, 28, 4, 9, 14, 19]], ["FSP", 10, 0, 3, 3], ["FSP", 10, 4, 4, 3], ["FSP", 10, 8, 5, 3], ["FSP", 10, 12, 6, 3], ["RE", 10, [0, 4, 8, 12, 1, 5, 9, 13, 2, 6, 10, 14, 3, 7, 11, 15]], ["CA", 3, 10, 11], ["CHR", 2, "shared", [3]], ["CA", 3, 4, 14], ["CHR", 1, "shared", [4]], ["CA", 2, 5, 14], ["CI", 1], ["FU", 12, [0, 1, 2, 3]], ["AN", 12, 0, 5], ["FU", 12, [1, 2, 3, 4]], ["AN", 12, 1, 4], ["FU", 12, [2, 3, 4, 5]], ["AN", 12, 2, 6], ["FU", 4, [0, 1, 2, 3]], ["SP", 4, 0, 14, [1], 1], ["AN", 4, 1, 2], ["FFSP", 4, 0, [6, 5, 4, 3], 1, 1], ["AN", 4, 1, 6], ["FU", 2, [0, 1, 2, 3]], ["SP", 2, 0, 169, [1], 1], ["AN", 2, 1, 2], ["FFSP", 2, 0, [6, 5, 4, 3], 1, 1], ["AN", 2, 1, 6], ["PR", 5, 0, "auto_unroll_max_step$512"]]]], "r": [[0.000576801], 0, 2.47828, 1628016581], "v": "v0.6"}
{"i": [["[\"254e44c32ef688b0884d158c1b90abc6\", 1, 3, 230, 230, 64, 3, 7, 7, 1, 64, 1, 1, 1, 64, 1, 1, 1, 64, 1, 1, 1, 64, 112, 112]", "cuda -keys=cuda,gpu -max_num_threads=1024 -thread_warp_size=32", [-1, 16, 64, 49152, 2147483647, 1024, 8, 32], "", 0, []], [[], [["CI", 9], ["CI", 7], ["CI", 5], ["SP", 3, 0, 1, [1, 1, 1, 1], 1], ["SP", 3, 5, 64, [1, 1, 2, 16], 1], ["SP", 3, 10, 112, [1, 14, 1, 1], 1], ["SP", 3, 15, 112, [1, 2, 7, 1], 1], ["SP", 3, 20, 3, [1, 3], 1], ["SP", 3, 23, 7, [7, 1], 1], ["SP", 3, 26, 7, [7, 1], 1], ["RE", 3, [0, 5, 10, 15, 1, 6, 11, 16, 2, 7, 12, 17, 20, 23, 26, 21, 24, 27, 3, 8, 13, 18, 22, 25, 28, 4, 9, 14, 19]], ["FSP", 10, 0, 3, 3], ["FSP", 10, 4, 4, 3], ["FSP", 10, 8, 5, 3], ["FSP", 10, 12, 6, 3], ["RE", 10, [0, 4, 8, 12, 1, 5, 9, 13, 2, 6, 10, 14, 3, 7, 11, 15]], ["CA", 3, 10, 11], ["CHR", 2, "shared", [3]], ["CA", 3, 4, 14], ["CHR", 1, "shared", [4]], ["CA", 2, 5, 14], ["CI", 1], ["FU", 12, [0, 1, 2, 3]], ["AN", 12, 0, 5], ["FU", 12, [1, 2, 3, 4]], ["AN", 12, 1, 4], ["FU", 12, [2, 3, 4, 5]], ["AN", 12, 2, 6], ["FU", 4, [0, 1, 2, 3]], ["SP", 4, 0, 2352, [1], 1], ["AN", 4, 1, 2], ["FFSP", 4, 0, [6, 5, 4, 3], 1, 1], ["AN", 4, 1, 6], ["FU", 2, [0, 1, 2, 3]], ["SP", 2, 0, 399, [21], 1], ["AN", 2, 1, 2], ["FFSP", 2, 0, [6, 5, 4, 3], 1, 1], ["AN", 2, 1, 6], ["PR", 5, 0, "auto_unroll_max_step$64"]]]], "r": [[0.000268149], 0, 2.34951, 1628016582], "v": "v0.6"}
{"i": [["[\"254e44c32ef688b0884d158c1b90abc6\", 1, 3, 230, 230, 64, 3, 7, 7, 1, 64, 1, 1, 1, 64, 1, 1, 1, 64, 1, 1, 1, 64, 112, 112]", "cuda -keys=cuda,gpu -max_num_threads=1024 -thread_warp_size=32", [-1, 16, 64, 49152, 2147483647, 1024, 8, 32], "", 0, []], [[], [["CI", 9], ["CI", 7], ["CI", 5], ["SP", 3, 0, 1, [1, 1, 1, 1], 1], ["SP", 3, 5, 64, [4, 2, 8, 1], 1], ["SP", 3, 10, 112, [1, 14, 4, 2], 1], ["SP", 3, 15, 112, [1, 1, 2, 1], 1], ["SP", 3, 20, 3, [3, 1], 1], ["SP", 3, 23, 7, [1, 7], 1], ["SP", 3, 26, 7, [1, 1], 1], ["RE", 3, [0, 5, 10, 15, 1, 6, 11, 16, 2, 7, 12, 17, 20, 23, 26, 21, 24, 27, 3, 8, 13, 18, 22, 25, 28, 4, 9, 14, 19]], ["FSP", 10, 0, 3, 3], ["FSP", 10, 4, 4, 3], ["FSP", 10, 8, 5, 3], ["FSP", 10, 12, 6, 3], ["RE", 10, [0, 4, 8, 12, 1, 5, 9, 13, 2, 6, 10, 14, 3, 7, 11, 15]], ["CA", 3, 10, 11], ["CHR", 2, "shared", [3]], ["CA", 3, 4, 14], ["CHR", 1, "shared", [4]], ["CA", 2, 5, 14], ["CI", 1], ["FU", 12, [0, 1, 2, 3]], ["AN", 12, 0, 5], ["FU", 12, [1, 2, 3, 4]], ["AN", 12, 1, 4], ["FU", 12, [2, 3, 4, 5]], ["AN", 12, 2, 6], ["FU", 4, [0, 1, 2, 3]], ["SP", 4, 0, 42, [1], 1], ["AN", 4, 1, 2], ["FFSP", 4, 0, [6, 5, 4, 3], 1, 1], ["AN", 4, 1, 6], ["FU", 2, [0, 1, 2, 3]], ["SP", 2, 0, 63, [1], 1], ["AN", 2, 1, 2], ["FFSP", 2, 0, [6, 5, 4, 3], 1, 1], ["AN", 2, 1, 6], ["PR", 5, 0, "auto_unroll_max_step$0"]]]], "r": [[0.000456148], 0, 1.98544, 1628016583], "v": "v0.6"}
{"i": [["[\"254e44c32ef688b0884d158c1b90abc6\", 1, 3, 230, 230, 64, 3, 7, 7, 1, 64, 1, 1, 1, 64, 1, 1, 1, 64, 1, 1, 1, 64, 112, 112]", "cuda -keys=cuda,gpu -max_num_threads=1024 -thread_warp_size=32", [-1, 16, 64, 49152, 2147483647, 1024, 8, 32], "", 0, []], [[], [["CI", 9], ["CI", 7], ["CI", 5], ["SP", 3, 0, 1, [1, 1, 1, 1], 1], ["SP", 3, 5, 64, [1, 8, 1, 1], 1], ["SP", 3, 10, 112, [7, 1, 1, 1], 1], ["SP", 3, 15, 112, [1, 7, 2, 1], 1], ["SP", 3, 20, 3, [3, 1], 1], ["SP", 3, 23, 7, [7, 1], 1], ["SP", 3, 26, 7, [1, 1], 1], ["RE", 3, [0, 5, 10, 15, 1, 6, 11, 16, 2, 7, 12, 17, 20, 23, 26, 21, 24, 27, 3, 8, 13, 18, 22, 25, 28, 4, 9, 14, 19]], ["FSP", 10, 0, 3, 3], ["FSP", 10, 4, 4, 3], ["FSP", 10, 8, 5, 3], ["FSP", 10, 12, 6, 3], ["RE", 10, [0, 4, 8, 12, 1, 5, 9, 13, 2, 6, 10, 14, 3, 7, 11, 15]], ["CA", 3, 10, 11], ["CHR", 2, "shared", [3]], ["CA", 3, 4, 14], ["CHR", 1, "shared", [4]], ["CA", 2, 5, 14], ["CI", 1], ["FU", 12, [0, 1, 2, 3]], ["AN", 12, 0, 5], ["FU", 12, [1, 2, 3, 4]], ["AN", 12, 1, 4], ["FU", 12, [2, 3, 4, 5]], ["AN", 12, 2, 6], ["FU", 4, [0, 1, 2, 3]], ["SP", 4, 0, 3, [1], 1], ["AN", 4, 1, 2], ["FFSP", 4, 0, [6, 5, 4, 3], 1, 1], ["AN", 4, 1, 6], ["FU", 2, [0, 1, 2, 3]], ["SP", 2, 0, 9, [1], 1], ["AN", 2, 1, 2], ["FFSP", 2, 0, [6, 5, 4, 3], 1, 1], ["AN", 2, 1, 6], ["PR", 5, 0, "auto_unroll_max_step$1024"]]]], "r": [[5.08694e-05], 0, 2.12486, 1628016584], "v": "v0.6"}
{"i": [["[\"254e44c32ef688b0884d158c1b90abc6\", 1, 3, 230, 230, 64, 3, 7, 7, 1, 64, 1, 1, 1, 64, 1, 1, 1, 64, 1, 1, 1, 64, 112, 112]", "cuda -keys=cuda,gpu -max_num_threads=1024 -thread_warp_size=32", [-1, 16, 64, 49152, 2147483647, 1024, 8, 32], "", 0, []], [[], [["CI", 9], ["CI", 7], ["CI", 5], ["SP", 3, 0, 1, [1, 1, 1, 1], 1], ["SP", 3, 5, 64, [1, 4, 4, 2], 1], ["SP", 3, 10, 112, [1, 4, 1, 1], 1], ["SP", 3, 15, 112, [2, 14, 1, 2], 1], ["SP", 3, 20, 3, [3, 1], 1], ["SP", 3, 23, 7, [7, 1], 1], ["SP", 3, 26, 7, [1, 1], 1], ["RE", 3, [0, 5, 10, 15, 1, 6, 11, 16, 2, 7, 12, 17, 20, 23, 26, 21, 24, 27, 3, 8, 13, 18, 22, 25, 28, 4, 9, 14, 19]], ["FSP", 10, 0, 3, 3], ["FSP", 10, 4, 4, 3], ["FSP", 10, 8, 5, 3], ["FSP", 10, 12, 6, 3], ["RE", 10, [0, 4, 8, 12, 1, 5, 9, 13, 2, 6, 10, 14, 3, 7, 11, 15]], ["CA", 3, 10, 11], ["CHR", 2, "shared", [3]], ["CA", 3, 4, 14], ["CHR", 1, "shared", [4]], ["CA", 2, 5, 14], ["CI", 1], ["FU", 12, [0, 1, 2, 3]], ["AN", 12, 0, 5], ["FU", 12, [1, 2, 3, 4]], ["AN", 12, 1, 4], ["FU", 12, [2, 3, 4, 5]], ["AN", 12, 2, 6], ["FU", 4, [0, 1, 2, 3]], ["SP", 4, 0, 168, [1], 1], ["AN", 4, 1, 2], ["FFSP", 4, 0, [6, 5, 4, 3], 1, 1], ["AN", 4, 1, 6], ["FU", 2, [0, 1, 2, 3]], ["SP", 2, 0, 21, [1], 1], ["AN", 2, 1, 2], ["FFSP", 2, 0, [6, 5, 4, 3], 1, 1], ["AN", 2, 1, 6], ["PR", 5, 0, "auto_unroll_max_step$0"]]]], "r": [[5.78651e-05], 0, 1.74512, 1628016585], "v": "v0.6"}
{"i": [["[\"254e44c32ef688b0884d158c1b90abc6\", 1, 3, 230, 230, 64, 3, 7, 7, 1, 64, 1, 1, 1, 64, 1, 1, 1, 64, 1, 1, 1, 64, 112, 112]", "cuda -keys=cuda,gpu -max_num_threads=1024 -thread_warp_size=32", [-1, 16, 64, 49152, 2147483647, 1024, 8, 32], "", 0, []], [[], [["CI", 9], ["CI", 7], ["CI", 5], ["SP", 3, 0, 1, [1, 1, 1, 1], 1], ["SP", 3, 5, 64, [4, 4, 4, 1], 1], ["SP", 3, 10, 112, [2, 14, 1, 1], 1], ["SP", 3, 15, 112, [1, 1, 8, 1], 1], ["SP", 3, 20, 3, [1, 3], 1], ["SP", 3, 23, 7, [1, 1], 1], ["SP", 3, 26, 7, [1, 1], 1], ["RE", 3, [0, 5, 10, 15, 1, 6, 11, 16, 2, 7, 12, 17, 20, 23, 26, 21, 24, 27, 3, 8, 13, 18, 22, 25, 28, 4, 9, 14, 19]], ["FSP", 10, 0, 3, 3], ["FSP", 10, 4, 4, 3], ["FSP", 10, 8, 5, 3], ["FSP", 10, 12, 6, 3], ["RE", 10, [0, 4, 8, 12, 1, 5, 9, 13, 2, 6, 10, 14, 3, 7, 11, 15]], ["CA", 3, 10, 11], ["CHR", 2, "shared", [3]], ["CA", 3, 4, 14], ["CHR", 1, "shared", [4]], ["CA", 2, 5, 14], ["CI", 1], ["FU", 12, [0, 1, 2, 3]], ["AN", 12, 0, 5], ["FU", 12, [1, 2, 3, 4]], ["AN", 12, 1, 4], ["FU", 12, [2, 3, 4, 5]], ["AN", 12, 2, 6], ["FU", 4, [0, 1, 2, 3]], ["SP", 4, 0, 84, [1], 1], ["AN", 4, 1, 2], ["FFSP", 4, 0, [6, 5, 4, 3], 1, 1], ["AN", 4, 1, 6], ["FU", 2, [0, 1, 2, 3]], ["SP", 2, 0, 63, [7], 1], ["AN", 2, 1, 2], ["FFSP", 2, 0, [6, 5, 4, 3], 1, 1], ["AN", 2, 1, 6], ["PR", 5, 0, "auto_unroll_max_step$16"]]]], "r": [[0.00080254], 0, 1.3774, 1628016586], "v": "v0.6"}
{"i": [["[\"254e44c32ef688b0884d158c1b90abc6\", 1, 3, 230, 230, 64, 3, 7, 7, 1, 64, 1, 1, 1, 64, 1, 1, 1, 64, 1, 1, 1, 64, 112, 112]", "cuda -keys=cuda,gpu -max_num_threads=1024 -thread_warp_size=32", [-1, 16, 64, 49152, 2147483647, 1024, 8, 32], "", 0, []], [[], [["CI", 9], ["CI", 7], ["CI", 5], ["SP", 3, 0, 1, [1, 1, 1, 1], 1], ["SP", 3, 5, 64, [1, 4, 2, 1], 1], ["SP", 3, 10, 112, [2, 2, 2, 2], 1], ["SP", 3, 15, 112, [2, 4, 7, 1], 1], ["SP", 3, 20, 3, [3, 1], 1], ["SP", 3, 23, 7, [1, 1], 1], ["SP", 3, 26, 7, [1, 1], 1], ["RE", 3, [0, 5, 10, 15, 1, 6, 11, 16, 2, 7, 12, 17, 20, 23, 26, 21, 24, 27, 3, 8, 13, 18, 22, 25, 28, 4, 9, 14, 19]], ["FSP", 10, 0, 3, 3], ["FSP", 10, 4, 4, 3], ["FSP", 10, 8, 5, 3], ["FSP", 10, 12, 6, 3], ["RE", 10, [0, 4, 8, 12, 1, 5, 9, 13, 2, 6, 10, 14, 3, 7, 11, 15]], ["CA", 3, 10, 11], ["CHR", 2, "shared", [3]], ["CA", 3, 4, 14], ["CHR", 1, "shared", [4]], ["CA", 2, 5, 14], ["CI", 1], ["FU", 12, [0, 1, 2, 3]], ["AN", 12, 0, 5], ["FU", 12, [1, 2, 3, 4]], ["AN", 12, 1, 4], ["FU", 12, [2, 3, 4, 5]], ["AN", 12, 2, 6], ["FU", 4, [0, 1, 2, 3]], ["SP", 4, 0, 6, [1], 1], ["AN", 4, 1, 2], ["FFSP", 4, 0, [6, 5, 4, 3], 1, 1], ["AN", 4, 1, 6], ["FU", 2, [0, 1, 2, 3]], ["SP", 2, 0, 273, [1], 1], ["AN", 2, 1, 2], ["FFSP", 2, 0, [6, 5, 4, 3], 1, 1], ["AN", 2, 1, 6], ["PR", 5, 0, "auto_unroll_max_step$0"]]]], "r": [[0.00358641], 0, 2.06031, 1628016590], "v": "v0.6"}
{"i": [["[\"254e44c32ef688b0884d158c1b90abc6\", 1, 3, 230, 230, 64, 3, 7, 7, 1, 64, 1, 1, 1, 64, 1, 1, 1, 64, 1, 1, 1, 64, 112, 112]", "cuda -keys=cuda,gpu -max_num_threads=1024 -thread_warp_size=32", [-1, 16, 64, 49152, 2147483647, 1024, 8, 32], "", 0, []], [[], [["CI", 9], ["CI", 7], ["CI", 5], ["SP", 3, 0, 1, [1, 1, 1, 1], 1], ["SP", 3, 5, 64, [8, 4, 1, 1], 1], ["SP", 3, 10, 112, [1, 7, 1, 2], 1], ["SP", 3, 15, 112, [1, 4, 2, 1], 1], ["SP", 3, 20, 3, [3, 1], 1], ["SP", 3, 23, 7, [1, 7], 1], ["SP", 3, 26, 7, [1, 1], 1], ["RE", 3, [0, 5, 10, 15, 1, 6, 11, 16, 2, 7, 12, 17, 20, 23, 26, 21, 24, 27, 3, 8, 13, 18, 22, 25, 28, 4, 9, 14, 19]], ["FSP", 10, 0, 3, 3], ["FSP", 10, 4, 4, 3], ["FSP", 10, 8, 5, 3], ["FSP", 10, 12, 6, 3], ["RE", 10, [0, 4, 8, 12, 1, 5, 9, 13, 2, 6, 10, 14, 3, 7, 11, 15]], ["CA", 3, 10, 11], ["CHR", 2, "shared", [3]], ["CA", 3, 4, 14], ["CHR", 1, "shared", [4]], ["CA", 2, 5, 14], ["CI", 1], ["FU", 12, [0, 1, 2, 3]], ["AN", 12, 0, 5], ["FU", 12, [1, 2, 3, 4]], ["AN", 12, 1, 4], ["FU", 12, [2, 3, 4, 5]], ["AN", 12, 2, 6], ["FU", 4, [0, 1, 2, 3]], ["SP", 4, 0, 7, [1], 1], ["AN", 4, 1, 2], ["FFSP", 4, 0, [6, 5, 4, 3], 1, 1], ["AN", 4, 1, 6], ["FU", 2, [0, 1, 2, 3]], ["SP", 2, 0, 27, [1], 1], ["AN", 2, 1, 2], ["FFSP", 2, 0, [6, 5, 4, 3], 1, 1], ["AN", 2, 1, 6], ["PR", 5, 0, "auto_unroll_max_step$64"]]]], "r": [[4.02672e-05], 0, 1.78957, 1628016591], "v": "v0.6"}
{"i": [["[\"254e44c32ef688b0884d158c1b90abc6\", 1, 3, 230, 230, 64, 3, 7, 7, 1, 64, 1, 1, 1, 64, 1, 1, 1, 64, 1, 1, 1, 64, 112, 112]", "cuda -keys=cuda,gpu -max_num_threads=1024 -thread_warp_size=32", [-1, 16, 64, 49152, 2147483647, 1024, 8, 32], "", 0, []], [[], [["CI", 9], ["CI", 7], ["CI", 5], ["SP", 3, 0, 1, [1, 1, 1, 1], 1], ["SP", 3, 5, 64, [2, 1, 2, 1], 1], ["SP", 3, 10, 112, [1, 2, 1, 4], 1], ["SP", 3, 15, 112, [4, 28, 1, 1], 1], ["SP", 3, 20, 3, [1, 3], 1], ["SP", 3, 23, 7, [1, 1], 1], ["SP", 3, 26, 7, [1, 7], 1], ["RE", 3, [0, 5, 10, 15, 1, 6, 11, 16, 2, 7, 12, 17, 20, 23, 26, 21, 24, 27, 3, 8, 13, 18, 22, 25, 28, 4, 9, 14, 19]], ["FSP", 10, 0, 3, 3], ["FSP", 10, 4, 4, 3], ["FSP", 10, 8, 5, 3], ["FSP", 10, 12, 6, 3], ["RE", 10, [0, 4, 8, 12, 1, 5, 9, 13, 2, 6, 10, 14, 3, 7, 11, 15]], ["CA", 3, 10, 11], ["CHR", 2, "shared", [3]], ["CA", 3, 4, 14], ["CHR", 1, "shared", [4]], ["CA", 2, 5, 14], ["CI", 1], ["FU", 12, [0, 1, 2, 3]], ["AN", 12, 0, 5], ["FU", 12, [1, 2, 3, 4]], ["AN", 12, 1, 4], ["FU", 12, [2, 3, 4, 5]], ["AN", 12, 2, 6], ["FU", 4, [0, 1, 2, 3]], ["SP", 4, 0, 42, [1], 1], ["AN", 4, 1, 2], ["FFSP", 4, 0, [6, 5, 4, 3], 1, 1], ["AN", 4, 1, 6], ["FU", 2, [0, 1, 2, 3]], ["SP", 2, 0, 147, [1], 1], ["AN", 2, 1, 2], ["FFSP", 2, 0, [6, 5, 4, 3], 1, 1], ["AN", 2, 1, 6], ["PR", 5, 0, "auto_unroll_max_step$512"]]]], "r": [[0.000415791], 0, 3.78739, 1628016593], "v": "v0.6"}
{"i": [["[\"254e44c32ef688b0884d158c1b90abc6\", 1, 3, 230, 230, 64, 3, 7, 7, 1, 64, 1, 1, 1, 64, 1, 1, 1, 64, 1, 1, 1, 64, 112, 112]", "cuda -keys=cuda,gpu -max_num_threads=1024 -thread_warp_size=32", [-1, 16, 64, 49152, 2147483647, 1024, 8, 32], "", 0, []], [[], [["CI", 9], ["CI", 7], ["CI", 5], ["SP", 3, 0, 1, [1, 1, 1, 1], 1], ["SP", 3, 5, 64, [1, 2, 8, 1], 1], ["SP", 3, 10, 112, [4, 4, 7, 1], 1], ["SP", 3, 15, 112, [1, 16, 1, 1], 1], ["SP", 3, 20, 3, [1, 1], 1], ["SP", 3, 23, 7, [1, 7], 1], ["SP", 3, 26, 7, [1, 7], 1], ["RE", 3, [0, 5, 10, 15, 1, 6, 11, 16, 2, 7, 12, 17, 20, 23, 26, 21, 24, 27, 3, 8, 13, 18, 22, 25, 28, 4, 9, 14, 19]], ["FSP", 10, 0, 3, 3], ["FSP", 10, 4, 4, 3], ["FSP", 10, 8, 5, 3], ["FSP", 10, 12, 6, 3], ["RE", 10, [0, 4, 8, 12, 1, 5, 9, 13, 2, 6, 10, 14, 3, 7, 11, 15]], ["CA", 3, 10, 11], ["CHR", 2, "shared", [3]], ["CA", 3, 4, 14], ["CHR", 1, "shared", [4]], ["CA", 2, 5, 14], ["CI", 1], ["FU", 12, [0, 1, 2, 3]], ["AN", 12, 0, 5], ["FU", 12, [1, 2, 3, 4]], ["AN", 12, 1, 4], ["FU", 12, [2, 3, 4, 5]], ["AN", 12, 2, 6], ["FU", 4, [0, 1, 2, 3]], ["SP", 4, 0, 196, [1], 1], ["AN", 4, 1, 2], ["FFSP", 4, 0, [6, 5, 4, 3], 1, 1], ["AN", 4, 1, 6], ["FU", 2, [0, 1, 2, 3]], ["SP", 2, 0, 133, [19], 1], ["AN", 2, 1, 2], ["FFSP", 2, 0, [6, 5, 4, 3], 1, 1], ["AN", 2, 1, 6], ["PR", 5, 0, "auto_unroll_max_step$1024"]]]], "r": [[0.000174235], 0, 3.12747, 1628016595], "v": "v0.6"}
{"i": [["[\"254e44c32ef688b0884d158c1b90abc6\", 1, 3, 230, 230, 64, 3, 7, 7, 1, 64, 1, 1, 1, 64, 1, 1, 1, 64, 1, 1, 1, 64, 112, 112]", "cuda -keys=cuda,gpu -max_num_threads=1024 -thread_warp_size=32", [-1, 16, 64, 49152, 2147483647, 1024, 8, 32], "", 0, []], [[], [["CI", 9], ["CI", 7], ["CI", 5], ["SP", 3, 0, 1, [1, 1, 1, 1], 1], ["SP", 3, 5, 64, [2, 16, 2, 1], 1], ["SP", 3, 10, 112, [1, 2, 2, 2], 1], ["SP", 3, 15, 112, [1, 1, 1, 56], 1], ["SP", 3, 20, 3, [1, 1], 1], ["SP", 3, 23, 7, [1, 7], 1], ["SP", 3, 26, 7, [1, 7], 1], ["RE", 3, [0, 5, 10, 15, 1, 6, 11, 16, 2, 7, 12, 17, 20, 23, 26, 21, 24, 27, 3, 8, 13, 18, 22, 25, 28, 4, 9, 14, 19]], ["FSP", 10, 0, 3, 3], ["FSP", 10, 4, 4, 3], ["FSP", 10, 8, 5, 3], ["FSP", 10, 12, 6, 3], ["RE", 10, [0, 4, 8, 12, 1, 5, 9, 13, 2, 6, 10, 14, 3, 7, 11, 15]], ["CA", 3, 10, 11], ["CHR", 2, "shared", [3]], ["CA", 3, 4, 14], ["CHR", 1, "shared", [4]], ["CA", 2, 5, 14], ["CI", 1], ["FU", 12, [0, 1, 2, 3]], ["AN", 12, 0, 5], ["FU", 12, [1, 2, 3, 4]], ["AN", 12, 1, 4], ["FU", 12, [2, 3, 4, 5]], ["AN", 12, 2, 6], ["FU", 4, [0, 1, 2, 3]], ["SP", 4, 0, 14, [1], 1], ["AN", 4, 1, 2], ["FFSP", 4, 0, [6, 5, 4, 3], 1, 1], ["AN", 4, 1, 6], ["FU", 2, [0, 1, 2, 3]], ["SP", 2, 0, 819, [1], 1], ["AN", 2, 1, 2], ["FFSP", 2, 0, [6, 5, 4, 3], 1, 1], ["AN", 2, 1, 6], ["PR", 5, 0, "auto_unroll_max_step$16"]]]], "r": [[0.000753041], 0, 3.58966, 1628016596], "v": "v0.6"}
{"i": [["[\"254e44c32ef688b0884d158c1b90abc6\", 1, 3, 230, 230, 64, 3, 7, 7, 1, 64, 1, 1, 1, 64, 1, 1, 1, 64, 1, 1, 1, 64, 112, 112]", "cuda -keys=cuda,gpu -max_num_threads=1024 -thread_warp_size=32", [-1, 16, 64, 49152, 2147483647, 1024, 8, 32], "", 0, []], [[], [["CI", 9], ["CI", 7], ["CI", 5], ["SP", 3, 0, 1, [1, 1, 1, 1], 1], ["SP", 3, 5, 64, [1, 4, 16, 1], 1], ["SP", 3, 10, 112, [2, 1, 7, 1], 1], ["SP", 3, 15, 112, [2, 1, 1, 4], 1], ["SP", 3, 20, 3, [1, 3], 1], ["SP", 3, 23, 7, [7, 1], 1], ["SP", 3, 26, 7, [7, 1], 1], ["RE", 3, [0, 5, 10, 15, 1, 6, 11, 16, 2, 7, 12, 17, 20, 23, 26, 21, 24, 27, 3, 8, 13, 18, 22, 25, 28, 4, 9, 14, 19]], ["FSP", 10, 0, 3, 3], ["FSP", 10, 4, 4, 3], ["FSP", 10, 8, 5, 3], ["FSP", 10, 12, 6, 3], ["RE", 10, [0, 4, 8, 12, 1, 5, 9, 13, 2, 6, 10, 14, 3, 7, 11, 15]], ["CA", 3, 10, 11], ["CHR", 2, "shared", [3]], ["CA", 3, 4, 14], ["CHR", 1, "shared", [4]], ["CA", 2, 5, 14], ["CI", 1], ["FU", 12, [0, 1, 2, 3]], ["AN", 12, 0, 5], ["FU", 12, [1, 2, 3, 4]], ["AN", 12, 1, 4], ["FU", 12, [2, 3, 4, 5]], ["AN", 12, 2, 6], ["FU", 4, [0, 1, 2, 3]], ["SP", 4, 0, 147, [1], 1], ["AN", 4, 1, 2], ["FFSP", 4, 0, [6, 5, 4, 3], 1, 1], ["AN", 4, 1, 6], ["FU", 2, [0, 1, 2, 3]], ["SP", 2, 0, 741, [1], 1], ["AN", 2, 1, 2], ["FFSP", 2, 0, [6, 5, 4, 3], 1, 1], ["AN", 2, 1, 6], ["PR", 5, 0, "auto_unroll_max_step$64"]]]], "r": [[0.00502348], 0, 1.73975, 1628016597], "v": "v0.6"}
{"i": [["[\"254e44c32ef688b0884d158c1b90abc6\", 1, 3, 230, 230, 64, 3, 7, 7, 1, 64, 1, 1, 1, 64, 1, 1, 1, 64, 1, 1, 1, 64, 112, 112]", "cuda -keys=cuda,gpu -max_num_threads=1024 -thread_warp_size=32", [-1, 16, 64, 49152, 2147483647, 1024, 8, 32], "", 0, []], [[], [["CI", 9], ["CI", 7], ["CI", 5], ["SP", 3, 0, 1, [1, 1, 1, 1], 1], ["SP", 3, 5, 64, [1, 16, 1, 2], 1], ["SP", 3, 10, 112, [2, 4, 14, 1], 1], ["SP", 3, 15, 112, [4, 1, 1, 1], 1], ["SP", 3, 20, 3, [1, 1], 1], ["SP", 3, 23, 7, [1, 7], 1], ["SP", 3, 26, 7, [7, 1], 1], ["RE", 3, [0, 5, 10, 15, 1, 6, 11, 16, 2, 7, 12, 17, 20, 23, 26, 21, 24, 27, 3, 8, 13, 18, 22, 25, 28, 4, 9, 14, 19]], ["FSP", 10, 0, 3, 3], ["FSP", 10, 4, 4, 3], ["FSP", 10, 8, 5, 3], ["FSP", 10, 12, 6, 3], ["RE", 10, [0, 4, 8, 12, 1, 5, 9, 13, 2, 6, 10, 14, 3, 7, 11, 15]], ["CA", 3, 10, 11], ["CHR", 2, "shared", [3]], ["CA", 3, 4, 14], ["CHR", 1, "shared", [4]], ["CA", 2, 5, 14], ["CI", 1], ["FU", 12, [0, 1, 2, 3]], ["AN", 12, 0, 5], ["FU", 12, [1, 2, 3, 4]], ["AN", 12, 1, 4], ["FU", 12, [2, 3, 4, 5]], ["AN", 12, 2, 6], ["FU", 4, [0, 1, 2, 3]], ["SP", 4, 0, 98, [1], 1], ["AN", 4, 1, 2], ["FFSP", 4, 0, [6, 5, 4, 3], 1, 1], ["AN", 4, 1, 6], ["FU", 2, [0, 1, 2, 3]], ["SP", 2, 0, 231, [33], 1], ["AN", 2, 1, 2], ["FFSP", 2, 0, [6, 5, 4, 3], 1, 1], ["AN", 2, 1, 6], ["PR", 5, 0, "auto_unroll_max_step$0"]]]], "r": [[0.000309266], 0, 2.33473, 1628016598], "v": "v0.6"}
{"i": [["[\"254e44c32ef688b0884d158c1b90abc6\", 1, 3, 230, 230, 64, 3, 7, 7, 1, 64, 1, 1, 1, 64, 1, 1, 1, 64, 1, 1, 1, 64, 112, 112]", "cuda -keys=cuda,gpu -max_num_threads=1024 -thread_warp_size=32", [-1, 16, 64, 49152, 2147483647, 1024, 8, 32], "", 0, []], [[], [["CI", 9], ["CI", 7], ["CI", 5], ["SP", 3, 0, 1, [1, 1, 1, 1], 1], ["SP", 3, 5, 64, [1, 8, 2, 1], 1], ["SP", 3, 10, 112, [1, 4, 2, 1], 1], ["SP", 3, 15, 112, [7, 2, 1, 8], 1], ["SP", 3, 20, 3, [1, 3], 1], ["SP", 3, 23, 7, [1, 1], 1], ["SP", 3, 26, 7, [1, 1], 1], ["RE", 3, [0, 5, 10, 15, 1, 6, 11, 16, 2, 7, 12, 17, 20, 23, 26, 21, 24, 27, 3, 8, 13, 18, 22, 25, 28, 4, 9, 14, 19]], ["FSP", 10, 0, 3, 3], ["FSP", 10, 4, 4, 3], ["FSP", 10, 8, 5, 3], ["FSP", 10, 12, 6, 3], ["RE", 10, [0, 4, 8, 12, 1, 5, 9, 13, 2, 6, 10, 14, 3, 7, 11, 15]], ["CA", 3, 10, 11], ["CHR", 2, "shared", [3]], ["CA", 3, 4, 14], ["CHR", 1, "shared", [4]], ["CA", 2, 5, 14], ["CI", 1], ["FU", 12, [0, 1, 2, 3]], ["AN", 12, 0, 5], ["FU", 12, [1, 2, 3, 4]], ["AN", 12, 1, 4], ["FU", 12, [2, 3, 4, 5]], ["AN", 12, 2, 6], ["FU", 4, [0, 1, 2, 3]], ["SP", 4, 0, 6, [1], 1], ["AN", 4, 1, 2], ["FFSP", 4, 0, [6, 5, 4, 3], 1, 1], ["AN", 4, 1, 6], ["FU", 2, [0, 1, 2, 3]], ["SP", 2, 0, 135, [15], 1], ["AN", 2, 1, 2], ["FFSP", 2, 0, [6, 5, 4, 3], 1, 1], ["AN", 2, 1, 6], ["PR", 5, 0, "auto_unroll_max_step$64"]]]], "r": [[0.00151933], 0, 2.71168, 1628016600], "v": "v0.6"}
{"i": [["[\"254e44c32ef688b0884d158c1b90abc6\", 1, 3, 230, 230, 64, 3, 7, 7, 1, 64, 1, 1, 1, 64, 1, 1, 1, 64, 1, 1, 1, 64, 112, 112]", "cuda -keys=cuda,gpu -max_num_threads=1024 -thread_warp_size=32", [-1, 16, 64, 49152, 2147483647, 1024, 8, 32], "", 0, []], [[], [["CI", 9], ["CI", 7], ["CI", 5], ["SP", 3, 0, 1, [1, 1, 1, 1], 1], ["SP", 3, 5, 64, [2, 2, 4, 1], 1], ["SP", 3, 10, 112, [1, 8, 7, 1], 1], ["SP", 3, 15, 112, [1, 7, 1, 4], 1], ["SP", 3, 20, 3, [1, 1], 1], ["SP", 3, 23, 7, [1, 1], 1], ["SP", 3, 26, 7, [1, 7], 1], ["RE", 3, [0, 5, 10, 15, 1, 6, 11, 16, 2, 7, 12, 17, 20, 23, 26, 21, 24, 27, 3, 8, 13, 18, 22, 25, 28, 4, 9, 14, 19]], ["FSP", 10, 0, 3, 3], ["FSP", 10, 4, 4, 3], ["FSP", 10, 8, 5, 3], ["FSP", 10, 12, 6, 3], ["RE", 10, [0, 4, 8, 12, 1, 5, 9, 13, 2, 6, 10, 14, 3, 7, 11, 15]], ["CA", 3, 10, 11], ["CHR", 2, "shared", [3]], ["CA", 3, 4, 14], ["CHR", 1, "shared", [4]], ["CA", 2, 5, 14], ["CI", 1], ["FU", 12, [0, 1, 2, 3]], ["AN", 12, 0, 5], ["FU", 12, [1, 2, 3, 4]], ["AN", 12, 1, 4], ["FU", 12, [2, 3, 4, 5]], ["AN", 12, 2, 6], ["FU", 4, [0, 1, 2, 3]], ["SP", 4, 0, 28, [1], 1], ["AN", 4, 1, 2], ["FFSP", 4, 0, [6, 5, 4, 3], 1, 1], ["AN", 4, 1, 6], ["FU", 2, [0, 1, 2, 3]], ["SP", 2, 0, 169, [13], 1], ["AN", 2, 1, 2], ["FFSP", 2, 0, [6, 5, 4, 3], 1, 1], ["AN", 2, 1, 6], ["PR", 5, 0, "auto_unroll_max_step$16"]]]], "r": [[0.000266922], 0, 2.27735, 1628016601], "v": "v0.6"}
{"i": [["[\"254e44c32ef688b0884d158c1b90abc6\", 1, 3, 230, 230, 64, 3, 7, 7, 1, 64, 1, 1, 1, 64, 1, 1, 1, 64, 1, 1, 1, 64, 112, 112]", "cuda -keys=cuda,gpu -max_num_threads=1024 -thread_warp_size=32", [-1, 16, 64, 49152, 2147483647, 1024, 8, 32], "", 0, []], [[], [["CI", 9], ["CI", 7], ["CI", 5], ["SP", 3, 0, 1, [1, 1, 1, 1], 1], ["SP", 3, 5, 64, [4, 1, 16, 1], 1], ["SP", 3, 10, 112, [1, 7, 2, 1], 1], ["SP", 3, 15, 112, [1, 8, 1, 2], 1], ["SP", 3, 20, 3, [1, 3], 1], ["SP", 3, 23, 7, [7, 1], 1], ["SP", 3, 26, 7, [1, 1], 1], ["RE", 3, [0, 5, 10, 15, 1, 6, 11, 16, 2, 7, 12, 17, 20, 23, 26, 21, 24, 27, 3, 8, 13, 18, 22, 25, 28, 4, 9, 14, 19]], ["FSP", 10, 0, 3, 3], ["FSP", 10, 4, 4, 3], ["FSP", 10, 8, 5, 3], ["FSP", 10, 12, 6, 3], ["RE", 10, [0, 4, 8, 12, 1, 5, 9, 13, 2, 6, 10, 14, 3, 7, 11, 15]], ["CA", 3, 10, 11], ["CHR", 2, "shared", [3]], ["CA", 3, 4, 14], ["CHR", 1, "shared", [4]], ["CA", 2, 5, 14], ["CI", 1], ["FU", 12, [0, 1, 2, 3]], ["AN", 12, 0, 5], ["FU", 12, [1, 2, 3, 4]], ["AN", 12, 1, 4], ["FU", 12, [2, 3, 4, 5]], ["AN", 12, 2, 6], ["FU", 4, [0, 1, 2, 3]], ["SP", 4, 0, 336, [1], 1], ["AN", 4, 1, 2], ["FFSP", 4, 0, [6, 5, 4, 3], 1, 1], ["AN", 4, 1, 6], ["FU", 2, [0, 1, 2, 3]], ["SP", 2, 0, 81, [1], 1], ["AN", 2, 1, 2], ["FFSP", 2, 0, [6, 5, 4, 3], 1, 1], ["AN", 2, 1, 6], ["PR", 5, 0, "auto_unroll_max_step$1024"]]]], "r": [[0.000271982], 0, 3.60204, 1628016602], "v": "v0.6"}
{"i": [["[\"254e44c32ef688b0884d158c1b90abc6\", 1, 3, 230, 230, 64, 3, 7, 7, 1, 64, 1, 1, 1, 64, 1, 1, 1, 64, 1, 1, 1, 64, 112, 112]", "cuda -keys=cuda,gpu -max_num_threads=1024 -thread_warp_size=32", [-1, 16, 64, 49152, 2147483647, 1024, 8, 32], "", 0, []], [[], [["CI", 9], ["CI", 7], ["CI", 5], ["SP", 3, 0, 1, [1, 1, 1, 1], 1], ["SP", 3, 5, 64, [1, 64, 1, 1], 1], ["SP", 3, 10, 112, [2, 2, 4, 1], 1], ["SP", 3, 15, 112, [4, 1, 2, 2], 1], ["SP", 3, 20, 3, [1, 1], 1], ["SP", 3, 23, 7, [7, 1], 1], ["SP", 3, 26, 7, [7, 1], 1], ["RE", 3, [0, 5, 10, 15, 1, 6, 11, 16, 2, 7, 12, 17, 20, 23, 26, 21, 24, 27, 3, 8, 13, 18, 22, 25, 28, 4, 9, 14, 19]], ["FSP", 10, 0, 3, 3], ["FSP", 10, 4, 4, 3], ["FSP", 10, 8, 5, 3], ["FSP", 10, 12, 6, 3], ["RE", 10, [0, 4, 8, 12, 1, 5, 9, 13, 2, 6, 10, 14, 3, 7, 11, 15]], ["CA", 3, 10, 11], ["CHR", 2, "shared", [3]], ["CA", 3, 4, 14], ["CHR", 1, "shared", [4]], ["CA", 2, 5, 14], ["CI", 1], ["FU", 12, [0, 1, 2, 3]], ["AN", 12, 0, 5], ["FU", 12, [1, 2, 3, 4]], ["AN", 12, 1, 4], ["FU", 12, [2, 3, 4, 5]], ["AN", 12, 2, 6], ["FU", 4, [0, 1, 2, 3]], ["SP", 4, 0, 49, [1], 1], ["AN", 4, 1, 2], ["FFSP", 4, 0, [6, 5, 4, 3], 1, 1], ["AN", 4, 1, 6], ["FU", 2, [0, 1, 2, 3]], ["SP", 2, 0, 169, [1], 1], ["AN", 2, 1, 2], ["FFSP", 2, 0, [6, 5, 4, 3], 1, 1], ["AN", 2, 1, 6], ["PR", 5, 0, "auto_unroll_max_step$64"]]]], "r": [[0.000113948], 0, 2.25427, 1628016604], "v": "v0.6"}
{"i": [["[\"254e44c32ef688b0884d158c1b90abc6\", 1, 3, 230, 230, 64, 3, 7, 7, 1, 64, 1, 1, 1, 64, 1, 1, 1, 64, 1, 1, 1, 64, 112, 112]", "cuda -keys=cuda,gpu -max_num_threads=1024 -thread_warp_size=32", [-1, 16, 64, 49152, 2147483647, 1024, 8, 32], "", 0, []], [[], [["CI", 9], ["CI", 7], ["CI", 5], ["SP", 3, 0, 1, [1, 1, 1, 1], 1], ["SP", 3, 5, 64, [1, 8, 1, 1], 1], ["SP", 3, 10, 112, [7, 1, 1, 1], 1], ["SP", 3, 15, 112, [1, 7, 2, 1], 1], ["SP", 3, 20, 3, [3, 1], 1], ["SP", 3, 23, 7, [1, 1], 1], ["SP", 3, 26, 7, [1, 1], 1], ["RE", 3, [0, 5, 10, 15, 1, 6, 11, 16, 2, 7, 12, 17, 20, 23, 26, 21, 24, 27, 3, 8, 13, 18, 22, 25, 28, 4, 9, 14, 19]], ["FSP", 10, 0, 3, 3], ["FSP", 10, 4, 4, 3], ["FSP", 10, 8, 5, 3], ["FSP", 10, 12, 6, 3], ["RE", 10, [0, 4, 8, 12, 1, 5, 9, 13, 2, 6, 10, 14, 3, 7, 11, 15]], ["CA", 3, 10, 11], ["CHR", 2, "shared", [3]], ["CA", 3, 4, 14], ["CHR", 1, "shared", [4]], ["CA", 2, 5, 14], ["CI", 1], ["FU", 12, [0, 1, 2, 3]], ["AN", 12, 0, 5], ["FU", 12, [1, 2, 3, 4]], ["AN", 12, 1, 4], ["FU", 12, [2, 3, 4, 5]], ["AN", 12, 2, 6], ["FU", 4, [0, 1, 2, 3]], ["SP", 4, 0, 3, [3], 1], ["AN", 4, 1, 2], ["FFSP", 4, 0, [6, 5, 4, 3], 1, 1], ["AN", 4, 1, 6], ["FU", 2, [0, 1, 2, 3]], ["SP", 2, 0, 9, [1], 1], ["AN", 2, 1, 2], ["FFSP", 2, 0, [6, 5, 4, 3], 1, 1], ["AN", 2, 1, 6], ["PR", 5, 0, "auto_unroll_max_step$1024"]]]], "r": [[0.000126399], 0, 2.51588, 1628016605], "v": "v0.6"}
{"i": [["[\"254e44c32ef688b0884d158c1b90abc6\", 1, 3, 230, 230, 64, 3, 7, 7, 1, 64, 1, 1, 1, 64, 1, 1, 1, 64, 1, 1, 1, 64, 112, 112]", "cuda -keys=cuda,gpu -max_num_threads=1024 -thread_warp_size=32", [-1, 16, 64, 49152, 2147483647, 1024, 8, 32], "", 0, []], [[], [["CI", 9], ["CI", 7], ["CI", 5], ["SP", 3, 0, 1, [1, 1, 1, 1], 1], ["SP", 3, 5, 64, [2, 2, 4, 1], 1], ["SP", 3, 10, 112, [1, 8, 1, 1], 1], ["SP", 3, 15, 112, [1, 4, 2, 7], 1], ["SP", 3, 20, 3, [3, 1], 1], ["SP", 3, 23, 7, [1, 1], 1], ["SP", 3, 26, 7, [7, 1], 1], ["RE", 3, [0, 5, 10, 15, 1, 6, 11, 16, 2, 7, 12, 17, 20, 23, 26, 21, 24, 27, 3, 8, 13, 18, 22, 25, 28, 4, 9, 14, 19]], ["FSP", 10, 0, 3, 3], ["FSP", 10, 4, 4, 3], ["FSP", 10, 8, 5, 3], ["FSP", 10, 12, 6, 3], ["RE", 10, [0, 4, 8, 12, 1, 5, 9, 13, 2, 6, 10, 14, 3, 7, 11, 15]], ["CA", 3, 10, 11], ["CHR", 2, "shared", [3]], ["CA", 3, 4, 14], ["CHR", 1, "shared", [4]], ["CA", 2, 5, 14], ["CI", 1], ["FU", 12, [0, 1, 2, 3]], ["AN", 12, 0, 5], ["FU", 12, [1, 2, 3, 4]], ["AN", 12, 1, 4], ["FU", 12, [2, 3, 4, 5]], ["AN", 12, 2, 6], ["FU", 4, [0, 1, 2, 3]], ["SP", 4, 0, 588, [1], 1], ["AN", 4, 1, 2], ["FFSP", 4, 0, [6, 5, 4, 3], 1, 1], ["AN", 4, 1, 6], ["FU", 2, [0, 1, 2, 3]], ["SP", 2, 0, 693, [1], 1], ["AN", 2, 1, 2], ["FFSP", 2, 0, [6, 5, 4, 3], 1, 1], ["AN", 2, 1, 6], ["PR", 5, 0, "auto_unroll_max_step$512"]]]], "r": [[9.70642e-05], 0, 2.321, 1628016606], "v": "v0.6"}
{"i": [["[\"254e44c32ef688b0884d158c1b90abc6\", 1, 3, 230, 230, 64, 3, 7, 7, 1, 64, 1, 1, 1, 64, 1, 1, 1, 64, 1, 1, 1, 64, 112, 112]", "cuda -keys=cuda,gpu -max_num_threads=1024 -thread_warp_size=32", [-1, 16, 64, 49152, 2147483647, 1024, 8, 32], "", 0, []], [[], [["CI", 9], ["CI", 7], ["CI", 5], ["SP", 3, 0, 1, [1, 1, 1, 1], 1], ["SP", 3, 5, 64, [1, 1, 1, 64], 1], ["SP", 3, 10, 112, [2, 14, 2, 1], 1], ["SP", 3, 15, 112, [2, 7, 1, 1], 1], ["SP", 3, 20, 3, [3, 1], 1], ["SP", 3, 23, 7, [1, 1], 1], ["SP", 3, 26, 7, [1, 1], 1], ["RE", 3, [0, 5, 10, 15, 1, 6, 11, 16, 2, 7, 12, 17, 20, 23, 26, 21, 24, 27, 3, 8, 13, 18, 22, 25, 28, 4, 9, 14, 19]], ["FSP", 10, 0, 3, 3], ["FSP", 10, 4, 4, 3], ["FSP", 10, 8, 5, 3], ["FSP", 10, 12, 6, 3], ["RE", 10, [0, 4, 8, 12, 1, 5, 9, 13, 2, 6, 10, 14, 3, 7, 11, 15]], ["CA", 3, 10, 11], ["CHR", 2, "shared", [3]], ["CA", 3, 4, 14], ["CHR", 1, "shared", [4]], ["CA", 2, 5, 14], ["CI", 1], ["FU", 12, [0, 1, 2, 3]], ["AN", 12, 0, 5], ["FU", 12, [1, 2, 3, 4]], ["AN", 12, 1, 4], ["FU", 12, [2, 3, 4, 5]], ["AN", 12, 2, 6], ["FU", 4, [0, 1, 2, 3]], ["SP", 4, 0, 192, [1], 1], ["AN", 4, 1, 2], ["FFSP", 4, 0, [6, 5, 4, 3], 1, 1], ["AN", 4, 1, 6], ["FU", 2, [0, 1, 2, 3]], ["SP", 2, 0, 3, [1], 1], ["AN", 2, 1, 2], ["FFSP", 2, 0, [6, 5, 4, 3], 1, 1], ["AN", 2, 1, 6], ["PR", 5, 0, "auto_unroll_max_step$0"]]]], "r": [[0.00249105], 0, 1.99725, 1628016608], "v": "v0.6"}
{"i": [["[\"254e44c32ef688b0884d158c1b90abc6\", 1, 3, 230, 230, 64, 3, 7, 7, 1, 64, 1, 1, 1, 64, 1, 1, 1, 64, 1, 1, 1, 64, 112, 112]", "cuda -keys=cuda,gpu -max_num_threads=1024 -thread_warp_size=32", [-1, 16, 64, 49152, 2147483647, 1024, 8, 32], "", 0, []], [[], [["CI", 9], ["CI", 7], ["CI", 5], ["SP", 3, 0, 1, [1, 1, 1, 1], 1], ["SP", 3, 5, 64, [2, 16, 2, 1], 1], ["SP", 3, 10, 112, [2, 4, 1, 2], 1], ["SP", 3, 15, 112, [1, 4, 1, 14], 1], ["SP", 3, 20, 3, [1, 1], 1], ["SP", 3, 23, 7, [7, 1], 1], ["SP", 3, 26, 7, [1, 7], 1], ["RE", 3, [0, 5, 10, 15, 1, 6, 11, 16, 2, 7, 12, 17, 20, 23, 26, 21, 24, 27, 3, 8, 13, 18, 22, 25, 28, 4, 9, 14, 19]], ["FSP", 10, 0, 3, 3], ["FSP", 10, 4, 4, 3], ["FSP", 10, 8, 5, 3], ["FSP", 10, 12, 6, 3], ["RE", 10, [0, 4, 8, 12, 1, 5, 9, 13, 2, 6, 10, 14, 3, 7, 11, 15]], ["CA", 3, 10, 11], ["CHR", 2, "shared", [3]], ["CA", 3, 4, 14], ["CHR", 1, "shared", [4]], ["CA", 2, 5, 14], ["CI", 1], ["FU", 12, [0, 1, 2, 3]], ["AN", 12, 0, 5], ["FU", 12, [1, 2, 3, 4]], ["AN", 12, 1, 4], ["FU", 12, [2, 3, 4, 5]], ["AN", 12, 2, 6], ["FU", 4, [0, 1, 2, 3]], ["SP", 4, 0, 392, [2], 1], ["AN", 4, 1, 2], ["FFSP", 4, 0, [6, 5, 4, 3], 1, 1], ["AN", 4, 1, 6], ["FU", 2, [0, 1, 2, 3]], ["SP", 2, 0, 297, [1], 1], ["AN", 2, 1, 2], ["FFSP", 2, 0, [6, 5, 4, 3], 1, 1], ["AN", 2, 1, 6], ["PR", 5, 0, "auto_unroll_max_step$512"]]]], "r": [[0.00041201], 0, 2.34008, 1628016609], "v": "v0.6"}
